id,imieNazwisko,klub,dataUr,wiek,miejsceUr,plec,ukonczonaSzkola,wyksztalcenie,najwyzszyStopienNaukowy,liczbaStudiowPodyplomowych,zawod,nrOkreguWyborczego,okregWyborczy,wojewodztwoOkreguWyborczego,liczbaGlosow,stazParlamentarny,ktoraKadencja,czyAktywny,powodNieaktywnosci,nieaktywnoscKomentarz,nieaktywnoscKategoria
268,Marcin Ociepa,PiS,1984-10-21,41,Opole,M,"Uniwersytet Opolski, Wydział Historyczno-Pedagogiczny, Politologia - magister (2008) Wyższa Szkoła Biznesu w Dąbrowie Górniczej, Master of Business Administration (2018) - studia podyplomowe IESE Business School Uniwersytetu Nawarry w Barcelonie i Krajowa Szkoła Administracji Publicznej, Master of Public Administration (2019) - studia podyplomowe",wyższe,magister,2,nauczyciel akademicki,21,Opole,opolskie,40418,poseł na Sejm RP IX kadencji,2,True,,,
269,Marzena Okła-Drewnowicz,KO,1972-05-20,53,Skarżysko-Kamienna,K,"Katolicki Uniwersytet Lubelski, Wydział Nauk Społecznych, Socjologia - magister (1996) Wyższa Szkoła Handlowa w Kielcach, Organizacja pomocy Społecznej (2002) - studia podyplomowe",wyższe,magister,1,urzędnik samorządowy,33,Kielce,świętokrzyskie,64990,"poseł na Sejm RP VI, VII, VIII i IX kadencji",5,True,,,
270,Barbara Okuła,Polska2050,1973-12-04,52,Siemiatycze,K,"Wyższa Szkoła Finansów i Zarządzania w Białymstoku, Finanse i Bankowość, Finanse i Rachunkowość - magister (2002)",wyższe,magister,0,ekonomista,24,Białystok,podlaskie,3482,brak,1,True,,,
271,Barbara Oliwiecka,Polska2050,1977-01-07,49,Kalisz,K,"Uniwersytet im. Adama Mickiewicza w Poznaniu, Wydział Nauk Geograficznych i Geologicznych, Planowanie Przestrzenne Gospodarką Lokalną - magister (2000) Wyższa Szkoła Bankowa we Wrocławiu, Trener Biznesu (2008) - studia podyplomowe",wyższe,magister,1,"menedżer, trener kadry menedżerskiej",36,Kalisz,wielkopolskie,12214,brak,1,True,,,
272,Dorota Olko,Lewica,1988-01-13,37,Siedlce,K,"Uniwersytet Warszawski, Wydział Filozofii i Socjologii (w ramach Międzywydziałowych Indywidualnych Studiów Humanistycznych), Socjologia - magister (2011) Uniwersytet Warszawski, Wydział Dziennikarstwa i Nauk Politycznych (w ramach Międzywydziałowych Indywidualnych Studiów Humanistycznych), Dziennikarstwo i Komunikacja Społeczna - magister (2012) Uniwersytet Warszawski, Filologia Polska - redakcja językowa tekstu (2012) - studia podyplomowe Uniwersytet Warszawski - Instytut Socjologii, Socjologia (2016) - studia doktoranckie Uniwersytet Warszawski - Instytut Socjologii, Socjologia - doktor (2023)",wyższe,doktor,1,socjolog,19,Warszawa,mazowieckie,44188,brak,1,True,,,
273,Paweł Olszewski,KO,1979-12-11,46,Bydgoszcz,M,"Uniwersytet im. Adama Mickiewicza w Poznaniu, Wydział Prawa i Administracji, Zarządzanie i Marketing - magister (2003)",wyższe,magister,0,ekonomista,4,Bydgoszcz,kujawsko-pomorskie,35289,"poseł na Sejm RP V, VI, VII, VIII i IX kadencji",6,True,,,
274,Mirosław Adam Orliński,PSL,1986-07-21,39,Warszawa,M,"Uniwersytet Warszawski, Wydział Prawa i Administracji, Prawo - magister (2010) Uniwersytet Warszawski, Nauki Prawne (2017) - studia doktoranckie",wyższe,magister,0,prawnik,16,Płock,mazowieckie,9066,brak,1,True,,,
275,Łukasz Osmalak,Polska2050,1977-06-17,48,Mikołów,M,"Wyższa Szkoła Informatyki i Zarządzania w Bielsku-Białej, Wydział Informatyki, Zarządzanie Sieciami - inżynier (2000)",wyższe,inżynier,0,inżynier informatyk,30,Bielsko-Biała,śląskie,19616,brak,1,True,,,
276,Katarzyna Osos,KO,1980-11-17,45,Świebodzin,K,"Wyższa Szkoła Handlu i Prawa w Warszawie, Wydział Prawa, Prawo - magister (2004)",wyższe,magister,0,radca prawny,8,Zielona Góra,lubuskie,11832,poseł na Sejm RP VIII i IX kadencji,3,True,,,
277,Jacek Osuch,PiS,1958-08-28,67,Olkusz,M,"Akademia Górniczo-Hutnicza w Krakowie, Wydział Mechaniczny, Budowa Maszyn - inżynier (1988)",wyższe,inżynier,0,inżynier mechanik,13,Kraków,małopolskie,10386,"poseł na Sejm RP VI, VII, VIII i IX kadencji",5,True,,,
278,Jacek Ozdoba,PiS,1991-09-22,34,Warszawa,M,"Uniwersytet Kardynała Stefana Wyszyńskiego w Warszawie, Wydział Prawa i Administracji, Prawo - magister (2016)",wyższe,magister,0,prawnik,16,Płock,mazowieckie,19637,poseł na Sejm RP IX kadencji,2,False,Zrzeczenie,Wybrany na posła do Parlamentu Europejskiego,Mandat w Parlamencie Europejskim
279,Teresa Pamuła,PiS,1956-12-28,69,Lubaczów,K,"Akademia Rolnicza w Krakowie, Wydział Ogrodnictwa, Ogrodnictwo - magister inżynier (1980) Wyższa Szkoła Społeczno-Gospodarcza w Tyczynie, Wspólna Polityka Rolna i Funduszy Wspólnoty (2004) - studia podyplomowe",wyższe,magister inżynier,1,inżynier ogrodnik,22,Krosno,podkarpackie,15273,poseł na Sejm RP IX kadencji,2,True,,,
280,Paweł Papke,KO,1977-02-13,48,Starogard Gdański,M,"Uniwersytet Warmińsko-Mazurski w Olsztynie, Wydział Humanistyczny, Stosunki Międzynarodowe - licencjat (2007) Olsztyńska Szkoła Wyższa, Wydział Pedagogiczny, Pedagogika Promocji Zdrowia - magister (2012) Collegium Humanum - Szkoła Główna Menedżerska Warszawa, Executive Master of Business Administration (MBA) (2019) - studia podyplomowe",wyższe,magister,1,pedagog,35,Olsztyn,warmińsko-mazurskie,27023,"poseł na Sejm RP VII, VIII i IX kadencji",4,True,,,
281,Urszula Pasławska,PSL,1977-01-28,48,Biskupiec,K,"Uniwersytet Gdański, Wydział Prawa, Prawo - magister (2001) Uniwersytet Warmińsko-Mazurski w Olsztynie, Integracja Europejska (2004) - studia podyplomowe",wyższe,magister,1,prawnik,35,Olsztyn,warmińsko-mazurskie,26992,"poseł na Sejm RP VII, VIII i IX kadencji",4,True,,,
282,Krzysztof Paszyk,PSL,1979-04-10,46,Poznań,M,"Uniwersytet im. Adama Mickiewicza w Poznaniu, Wydział Prawa i Administracji, Prawo - magister (2005)",wyższe,magister,0,prawnik,38,Piła,wielkopolskie,27642,poseł na Sejm RP VIII i IX kadencji,3,True,,,
283,Karolina Pawliczak,KO,1976-06-25,49,Godziesze Wielkie,K,"Uniwersytet im. Adama Mickiewicza w Poznaniu, Wydział Prawa, Prawo - magister (2000) Uniwersytet Łódzki, Zarządzanie Jednostkami Samorządu Terytorialnego (2001) - studia podyplomowe Uniwersytet Ekonomiczny w Poznaniu, Gospodarka Nieruchomościami (2006) - studia podyplomowe",wyższe,magister,2,prawnik,36,Kalisz,wielkopolskie,21819,poseł na Sejm RP IX kadencji,2,True,,,
284,Bartłomiej Pejo,Konfederacja,1985-04-04,40,Świdnik,M,"Szkoła Główna Służby Pożarniczej, Inżynieria Bezpieczeństwa, Inżynieria Bezpieczeństwa - inżynier (2009) Politechnika Warszawska, Bezpieczeństwo, Higiena Pracy i Ergonomia (2010) - studia podyplomowe Szkoła Główna Służby Pożarniczej, Inżynieria Bezpieczeństwa, Inżynieria Bezpieczeństwa - magister inżynier (2011) Szkoła Główna Handlowa w Warszawie, Menadżer Samorządu Terytorialnego (2018) - studia podyplomowe",wyższe,magister inżynier,2,"inżynier, menedżer",6,Lublin,lubelskie,26037,brak,1,True,,,
285,Ryszard Petru,Polska2050,1972-07-06,53,Wrocław,M,"Szkoła Główna Handlowa w Warszawie, Międzynarodowe Stosunki Gospodarcze, Międzynarodowe Stosunki Gospodarcze - magister (1997)",wyższe,magister,0,doradca finansowy,19,Warszawa,mazowieckie,24192,poseł na Sejm RP VIII kadencji,2,True,,,
286,Małgorzata Pępek,KO,1961-06-10,64,Kocierz Rydzwałdzki,K,"Krakowska Szkoła Wyższa, Wydział Prawa i Administracji, Administracja - magister (2006) Polska Akademia Nauk, Zarządzanie w Polskiej Administracji Publicznej a Wspólna Europejska Przestrzeń Administracyjna (2010) - studia podyplomowe",wyższe,magister,1,ekonomista,27,Bielsko-Biała,śląskie,22184,"poseł na Sejm RP VII, VIII i IX kadencji",4,True,,,
287,Bolesław Piecha,PiS,1954-09-19,71,Rybnik,M,"Śląska Akademia Medyczna, Wydział Lekarski - lekarz (1983) Akademia Ekonomiczna im. K. Adamieckiego w Katowicach, Zarządzanie w Ochronie Zdrowia (2000) - studia podyplomowe",wyższe,lekarz,1,lekarz,30,Bielsko-Biała,śląskie,32427,"poseł na Sejm RP IV, V, VI, VII i IX kadencji, senator VIII kadencji",6,True,,,
288,Grzegorz Piechowiak,PiS,1963-09-14,62,Piła,M,"Akademia Teologii Katolickiej w Warszawie, Wydział Kościelnych Nauk Historycznych i Społecznych, Socjologia Religii - magister (1991) Wyższa Szkoła Zawodowa Kadry dla Europy w Poznaniu, Zarządzanie Przedsiębiorstwem w Kryzysie i Upadłości (2010) - studia podyplomowe",wyższe,magister,1,"nadzorca sądowy, syndyk, zarządca nieruchomości",38,Piła,wielkopolskie,13122,"poseł na Sejm RP III, VIII i IX kadencji",4,True,,,
289,Anna Pieczarka,PiS,1977-02-15,48,Tuchów,K,"Małopolska Wyższa Szkoła Ekonomiczna, Wydział Zarządzania i Turystyki, Zarządzanie - magister (2009) Uniwersytet Ekonomiczny w Krakowie - Krakowska Szkoła Biznesu, MBA (2021) - studia podyplomowe",wyższe,magister,1,"polityk, pracownik administracji samorządowej",15,Tarnów,małopolskie,71199,poseł na Sejm RP IX kadencji,2,True,,,
290,Katarzyna Maria Piekarska,KO,1967-09-23,58,Warszawa,K,"Uniwersytet Warszawski, Wydział Prawa i Administracji, Prawo - magister (1992) Aplikacja Sędziowska i Radcowska (1995)",wyższe,magister,0,radca prawny,19,Warszawa,mazowieckie,8748,"poseł na Sejm RP II, III, IV, V i IX kadencji",6,True,,,
291,Norbert Pietrykowski,Polska2050,1973-12-17,52,Mława,M,"Akademia Medyczna w Bydgoszczy, Wydział Farmaceutyczny, Analityka Medyczna - magister farmacji (1998) Uniwersytet Mikołaja Kopernika w Toruniu, doktor nauk humanistycznych - doktor (2011)",wyższe,doktor,0,analityk medyczny,4,Bydgoszcz,kujawsko-pomorskie,27596,brak,1,True,,,
292,Lucjan Marek Pietrzczyk,KO,1960-03-24,65,Bilcza,M,"Wyższa Szkoła Pedagogiczna w Kielcach, Wydział Pedagogiczny, Pedagogika Opiekuńczo-Wychowawcza - magister (1984) Wyższa Szkoła Pedagogiczna w Kielcach, Wychowanie Fizyczne (1986) - studia podyplomowe Instytut Badań Edukacyjnych Ministerstwa Edukacji Narodowej w Warszawie, Zarządzanie Oświatą (2001) - studia podyplomowe Wyższa Szkoła Administracji Publicznej w Kielcach, Samorząd i Administracja (2006) - studia podyplomowe",wyższe,magister,3,nauczyciel,33,Kielce,świętokrzyskie,5826,poseł na Sejm RP VII kadencji,2,True,,,
293,Dariusz Piontkowski,PiS,1964-12-17,61,Sielc,M,"Filia Uniwersytetu Warszawskiego w Białymstoku, Wydział Humanistyczny, Historia - magister (1988) Wyższa Szkoła Finansów i Zarządzania w Białymstoku, Studia Menadżerskie (1996) - studia podyplomowe Uniwersytet w Białymstoku, Zarządzanie Oświatą (2000) - studia podyplomowe Wyższa Szkoła Administracji Publicznej w Białymstoku, Zarządzanie Kadrami w Administracji Publicznej (2001) - studia podyplomowe",wyższe,magister,3,nauczyciel,24,Białystok,podlaskie,22147,"poseł na Sejm RP VII, VIII i IX kadencji",4,True,,,
294,Kazimierz Plocke,KO,1958-05-03,67,Domatowo,M,"Akademia Rolniczo-Techniczna w Olsztynie, Wydział Rolniczy, Ekonomia Rolnictwa - magister inżynier (1982) Akademia Rolniczo-Techniczna w Olsztynie, Ekonomia Rolnictwa - doktor (1988)",wyższe,doktor,0,inżynier rolnik,26,Słupsk,pomorskie,8154,"poseł na Sejm RP IV, V, VI, VII, VIII i IX kadencji",7,True,,,
295,Grzegorz Płaczek,Konfederacja,1978-05-13,47,Tarnowskie Góry,M,"Górnośląska Wyższa Szkoła Handlowa, Wydział Zarządzania, Zarządzanie i Marketing - magister (2002)",wyższe,magister,0,"nauczyciel, przedsiębiorca prywatny",31,Katowice,śląskie,18648,brak,1,True,,,
296,Kacper Płażyński,PiS,1989-05-10,36,Gdańsk,M,"Uniwersytet Gdański, Wydział Prawa i Administracji, Prawo - magister (2013) Pomorska Izba Adwokacka, Aplikacja Adwokacka (2016)",wyższe,magister,0,adwokat,25,Gdańsk,pomorskie,100445,poseł na Sejm RP IX kadencji,2,True,,,
297,Szymon Pogoda,PiS,1985-09-22,40,Bolesławiec,M,"Uniwersytet Wrocławski, Wydział Nauk Społecznych, Stosunki Międzynarodowe - licencjat (2010) Wyższa Szkoła Bankowa we Wrocławiu, Wydział Finansów i Zarządzania, Zarządzanie - magister (2018) Wyższa Szkoła Bankowa we Wrocławiu, Controlilng (2019) - studia podyplomowe Wyższa Szkoła Biznesu - National Louis University, Master of Business Administration (2022) - studia podyplomowe",wyższe,magister,2,menedżer,1,Legnica,dolnośląskie,10117,poseł na Sejm RP IX kadencji,2,True,,,
298,Jerzy Polaczek,PiS,1961-08-24,64,Piekary Śląskie,M,"Uniwersytet Śląski, Wydział Prawa, Prawo - magister (1986)",wyższe,magister,0,prawnik,31,Katowice,śląskie,5996,"poseł na Sejm RP III, IV, V, VI, VII, VIII i IX kadencji",8,True,,,
299,Elżbieta Anna Polak,KO,1959-09-06,66,Przemków,K,"Uniwersytet Wrocławski, Wydział Prawa i Administracji, Administracja - magister (1990) Uniwersytet Wrocławski, Zarządzanie Jednostkami Gospodarczymi (1995) - studia podyplomowe",wyższe,magister,1,administratywista,8,Zielona Góra,lubuskie,78475,brak,1,True,,,
300,Piotr Polak,PiS,1961-01-20,64,Grabinka,M,"Akademia Rolnicza w Poznaniu, Wydział Rolny, Mechanizacja Rolnictwa - magister inżynier (1985)",wyższe,magister inżynier,0,inżynier mechanizacji rolnictwa,11,Sieradz,łódzkie,23845,"poseł na Sejm RP VI, VII, VIII i IX kadencji",5,True,,,
301,Agnieszka Pomaska,KO,1980-01-08,46,Gdynia,K,"Uniwersytet Gdański, Wydział Nauk Politycznych, Politologia - magister (2005)",wyższe,magister,0,politolog,25,Gdańsk,pomorskie,83590,"poseł na Sejm RP VI, VII, VIII i IX kadencji",5,True,,,
302,Marcin Porzucek,PiS,1984-07-20,41,Kielce,M,"Wyższa Szkoła Stosunków Międzynarodowych i Amerykanistyki w Warszawie, Wydział Dyplomacji i Stosunków Międzynarodowych, Politologia - licencjat (2013) Collegium Civitas (Warszawa), Bezpieczeństwo Energetyczne Polski (2014) - studia podyplomowe",wyższe,licencjat,1,politolog,38,Piła,wielkopolskie,28293,poseł na Sejm RP VIII i IX kadencji,3,True,,,
303,Jacek Protas,KO,1964-01-15,61,Lidzbark Warmiński,M,"Akademia Wychowania Fizycznego w Gdańsku, Wydział Trenerski, Koszykówka - magister (1987) Uniwersytet Warmińsko-Mazurski w Olsztynie, Zarządzanie w Administracji Publicznej (2001) - studia podyplomowe Akademia Finansów i Biznesu Vistula w Warszawie, MBA - Dyplomacja (2023) - studia podyplomowe",wyższe,magister,2,"nauczyciel, trener",34,Elbląg,warmińsko-mazurskie,35745,poseł na Sejm RP VIII i IX kadencji,3,False,Zrzeczenie,Wybrany na posła do Parlamentu Europejskiego,Mandat w Parlamencie Europejskim
304,Marcin Przydacz,PiS,1985-06-26,40,Wieluń,M,"Uniwersytet Jagielloński w Krakowie, Wydział Prawa i Administracji, Prawo - magister (2010) Uniwersytet Warszawski, Szkoła Prawa Włoskiego i Europejskiego (2012) - studia podyplomowe Okręgowa Izba Adwokacka w Krakowie, Aplikacja Adwokacka (2014)",wyższe,magister,1,adwokat,11,Sieradz,łódzkie,30423,brak,1,False,Zrzeczenie,Powołany na stanowisko Sekretarza Stanu - Szefa Biura Polityki Międzynarodowej w Kancelarii Prezydenta RP,Objęcie funkcji w administracji centralnej
305,Grzegorz Puda,PiS,1982-07-13,43,Bielsko-Biała,M,"Akademia Rolnicza w Krakowie, Wydział Hodowli i Biologii, Zootechnika - magister inżynier (2006)",wyższe,magister inżynier,0,menedżer marketingu,27,Bielsko-Biała,śląskie,33728,poseł na Sejm RP VIII i IX kadencji,3,True,,,
306,Michał Pyrzyk,PSL,1975-06-07,50,Poznań,M,"Uniwersytet im. Adama Mickiewicza w Poznaniu, Wydział Prawa i Administracji, Prawo - magister (1999) Polska Akademia Nauk, Instytut Nauk Prawnych, Studium Europejskiego Prawa Samorządowego, Prawo Europejskie, Stosunki Międzynarodowe i Prawne (2004) - studia podyplomowe",wyższe,magister,1,prawnik,37,Konin,wielkopolskie,10304,brak,1,True,,,
307,Renata Rak,KO,1973-06-29,52,Szczecinek,K,"Uniwersytet Gdański, Wydział Biologii, Geografii i Oceanologii, Biologia - magister (1997)",wyższe,magister,0,nauczyciel,40,Koszalin,zachodniopomorskie,9170,brak,1,True,,,
308,Ireneusz Raś,PSL,1972-09-30,53,Proszowice,M,"Uniwersytet Papieski im. Jana Pawła II w Krakowie, Wydział Historii, Historia - magister (1998)",wyższe,magister,0,urzędnik samorządowy,13,Kraków,małopolskie,27518,"poseł na Sejm RP V, VI, VII, VIII i IX kadencji",6,True,,,
309,Zbigniew Rau,PiS,1955-02-03,70,Łódź,M,"Uniwersytet Łódzki, Wydział Prawa i Administracji, Prawo - magister (1977) Wydział Prawa i Administracji Uniwersytetu Łódzkiego, Nauki Prawne (1982) - studia doktoranckie Wydział Prawa i Administracji Uniwersytetu Łódzkiego, Nauki Prawne - doktor habilitowany (1996)",wyższe,doktor habilitowany,0,nauczyciel akademicki,9,Łódź,łódzkie,32387,"poseł na Sejm RP IX kadencji, senator VI kadencji",2,True,,,
310,Marcin Romanowski,PiS,1976-01-20,49,Skrwilno,M,"Uniwersytet Mikołaja Kopernika w Toruniu, Wydział Prawa i Administracji, Prawo - magister (2000) Uniwersytet w Ratyzbonie, Magister Legum (LL. M.) (2022) - studia podyplomowe",wyższe,magister,1,"nauczyciel akademicki, prawnik",7,Chełm,lubelskie,17318,brak,1,True,,,
311,Bartosz Romowicz,Polska2050,1988-06-14,37,Lesko,M,"Katolicki Uniwersytet Lubelski Jana Pawła II, Wydział Zamiejscowy Nauk Ekonomicznych i Prawnych, Ekonomia - licencjat (2011) Katolicki Uniwersytet Lubelski Jana Pawła II, Wydział Zamiejscowy Nauk Ekonomicznych i Prawnych, Prawo - magister (2013) Uniwersytet Ekonomiczny w Krakowie, Finanse i Rachunkowość (2014) - studia podyplomowe Wyższa Szkoła Biznesu National Louis University w Nowym Sączu, MBA (2021) - studia podyplomowe",wyższe,magister,2,adwokat,22,Krosno,podkarpackie,21527,brak,1,True,,,
312,Monika Rosa,KO,1986-04-24,39,Czeladź,K,"Uniwersytet Śląski, Wydział Nauk Społecznych, Politologia, Dziennikarstwo i Komunikacja Społeczne - magister (2010)",wyższe,magister,0,politolog,31,Katowice,śląskie,44857,poseł na Sejm RP VIII i IX kadencji,3,True,,,
313,Wiesław Różyński,PSL,1968-06-26,57,Biłgoraj,M,"Uniwersytet Marii Curie-Skłodowskiej w Lublinie, Wydział Prawa i Administracji, Administracja - magister (2002) Uniwersytet Marii Curie-Skłodowskiej w Lublinie, Organizacja Pomocy Społecznej (2005) - studia podyplomowe",wyższe,magister,1,pracownik administracji samorządowej,7,Chełm,lubelskie,17237,brak,1,True,,,
314,Urszula Rusecka,PiS,1966-09-11,59,Kraków,K,"Akademia Ekonomiczna w Krakowie, Wydział Ekonomiki Obrotu, Ekonomika i Organizacja Obrotu i Usług - magister (1990)",wyższe,magister,0,"ekonomista, pracownik samorządowy",15,Tarnów,małopolskie,17080,"poseł na Sejm RP VII, VIII i IX kadencji",4,True,,,
315,Grzegorz Rusiecki,KO,1983-02-28,42,Leszno,M,"Uniwersytet im. Adama Mickiewicza w Poznaniu, Wydział Prawa i Administracji, Prawo - magister (2006)",wyższe,magister,0,prawnik,36,Kalisz,wielkopolskie,22410,poseł na Sejm RP IX kadencji,2,False,Zrzeczenie,Wybrany na funkcję Prezydenta Miasta Leszna,Objęcie funkcji w samorządzie
316,Jakub Rutnicki,KO,1978-12-03,47,Szamotuły,M,"Uniwersytet im. Adama Mickiewicza w Poznaniu, Politologia, Marketing Polityczny i Samorządowość - magister (2002)",wyższe,magister,0,politolog,38,Piła,wielkopolskie,67069,"poseł na Sejm RP V, VI, VII, VIII i IX kadencji",6,True,,,
317,Paweł Rychlik,PiS,1986-12-16,39,Wieluń,M,"Uniwersytet Medyczny w Poznaniu, Wydział Farmaceutyczny, Farmacja - magister (2013)",wyższe,magister,0,farmaceuta,11,Sieradz,łódzkie,27361,poseł na Sejm RP VIII i IX kadencji,3,True,,,
318,Marek Rząsa,KO,1957-10-04,68,Rzeszów,M,"Akademia Wychowania Fizycznego w Krakowie, Wydział Wychowania Fizycznego, Nauczycielski - magister (1984) Wyższa Szkoła Informatyki i Zarządzania w Rzeszowie, Organizacja i Zarządzanie Oświatą (2002) - studia podyplomowe",wyższe,magister,1,nauczyciel,22,Krosno,podkarpackie,13510,"poseł na Sejm RP VI, VII, VIII i IX kadencji",5,True,,,
319,Jarosław Rzepa,PSL,1972-08-22,53,Szamotuły,M,"Akademia Rolnicza w Szczecinie, Wydział Rolnictwa, Ogrodnictwo - magister inżynier (1997) Uniwersytet im. Adama Mickiewicza w Poznaniu, Wydział Biologii, Nauczanie biologii - licencjat (1997) Akademia Rolnicza w Krakowie, Hodowla Roślin i Nasiennictwo (2002) - studia podyplomowe Akademia Rolnicza w Szczecinie, Ogrodnictwo - doktor (2007)",wyższe,doktor,1,inżynier ogrodnik,41,Szczecin,zachodniopomorskie,21309,poseł na Sejm RP IX kadencji,2,True,,,
320,Jarosław Sachajko,Republikanie,1971-10-08,54,Lublin,M,"Szkoła Główna Gospodarstwa Wiejskiego w Warszawie, Wydział Ekonomiczno-Rolniczy, Ekonomia - magister (1998) Uniwersytet Przyrodniczy w Lublinie, Agrobioinżynieria - doktor (2010) Warszawska Szkoła Zarządzania-Szkoła Wyższa, Wycena Nieruchomości (2013) - studia podyplomowe",wyższe,doktor,1,przedsiębiorca prywatny,7,Chełm,lubelskie,33727,poseł na Sejm RP VIII i IX kadencji,3,True,,,
321,Paweł Sałek,PiS,1975-06-29,50,Skierniewice,M,"Politechnika Częstochowska, Wydział Inżynierii Mechanicznej i Informatyki, Mechanika i Budowa Maszyn - magister inżynier (2000) Szkoła Główna Gospodarstwa Wiejskiego w Warszawie, Oceny i wyceny zasobów przyrodniczych (2001) - studia podyplomowe MBA UW, Master of Business Administration (2009) - studia podyplomowe Wyższa Szkoła Kultury Społecznej i Medialnej w Toruniu, Relacje Międzynarodowe i Dyplomacja (2014) - studia podyplomowe",wyższe,magister inżynier,3,"inżynier mechanik, urzędnik państwowy",10,Piotrków Trybunalski,łódzkie,15200,brak,1,True,,,
322,Wojciech Saługa,KO,1969-03-27,56,Jaworzno,M,"Uniwersytet Ekonomiczny w Krakowie, Wydział Ekonomia Produkcji, Ekonomika i Organizacja Produkcji Przemysłowej - magister (1994)",wyższe,magister,0,ekonomista,32,Katowice,śląskie,28781,"poseł na Sejm RP V, VI, VII i IX kadencji, senator V kadencji",5,False,Zrzeczenie,Wybrany na funkcję Marszałka Województwa Śląskiego,Objęcie funkcji w samorządzie
323,Tadeusz Samborski,PSL,1945-08-08,80,Gańczary K. Lwowa,M,"Wyższa Szkoła Pedagogiczna w Gdańsku, Wydział Humanistyczny, Historia - magister (1969) Państwowy Uniwersytet im. M. Łomonosowa w Moskwie, Nauki Humanistyczne - doktor (1974)",wyższe,doktor,0,historyk,1,Legnica,dolnośląskie,16120,poseł na Sejm RP II i IV kadencji,3,True,,,
324,Jacek Sasin,PiS,1969-11-06,56,Warszawa,M,"Uniwersytet Warszawski, Wydział Historyczny, Historia - magister (1998) Akademia Leona Koźmińskiego, Zarządzanie w Administracji Publicznej (2005) - studia podyplomowe",wyższe,magister,1,urzędnik państwowy,24,Białystok,podlaskie,59490,"poseł na Sejm RP VII, VIII i IX kadencji",4,True,,,
325,Marek Sawicki,PSL,1958-04-08,67,Sawice,M,"Wyższa Szkoła Rolniczo-Pedagogiczna, Wydział Rolniczy, Rolnictwo - magister inżynier (1983) Polska Akademia Nauk w Warszawie, Wspólnotowe Prawo Rolne (1997) - studia podyplomowe Akademia Podlaska w Siedlcach, Agronomia - doktor (2006) Uniwersytet Przyrodniczo - Humanistyczny w Siedlcach, Nauki Rolnicze (2006) - studia doktoranckie",wyższe,doktor,1,rolnik,18,Siedlce,mazowieckie,25534,"poseł na Sejm RP II, III, IV, V, VI, VII, VIII i IX kadencji",9,True,,,
326,Ewa Schädler,Polska2050,1968-09-13,57,Poznań,K,"Katolicki Uniwersytet Lubelski w Lublinie, Wydział Teologiczny, Teologia - magister (1992) Katolicki Uniwersytet Lubelski Jana Pawła II, Teologia - doktor (2014) Wielkopolska Wyższa Szkoła Społeczno-Ekonomiczna w Środzie Wielkopolskiej, Nauki o Wychowaniu - Pedagogika (2018) - studia podyplomowe",wyższe,doktor,1,przedsiębiorca prywatny,39,Poznań,wielkopolskie,33815,brak,1,True,,,
327,Joanna Scheuring-Wielgus,Lewica,1972-02-08,53,Toruń,K,"Uniwersytet Mikołaja Kopernika w Toruniu, Wydział Humanistyczny, Socjologia - magister (1997) Polska Akademia Nauk w Warszawie, Zarządzanie Kulturą (2008) - studia podyplomowe",wyższe,magister,1,socjolog,5,Toruń,kujawsko-pomorskie,35193,poseł na Sejm RP VIII i IX kadencji,3,False,Zrzeczenie,Wybrana na posła do Parlamentu Europejskiego,Mandat w Parlamencie Europejskim
328,Anna Schmidt,PiS,1978-11-11,47,Jarosław,K,"Katolicki Uniwersytet Lubelski, Wydział Nauk Społecznych, Socjologia - magister (2003)",wyższe,magister,0,socjolog,22,Krosno,podkarpackie,28692,poseł na Sejm RP VIII i IX kadencji,3,True,,,
329,Łukasz Schreiber,PiS,1987-05-26,38,Bydgoszcz,M,"Wydział Administracji i Nauk Społecznych, Administracja - magister (2013)",wyższe,magister,0,urzędnik państwowy,4,Bydgoszcz,kujawsko-pomorskie,44413,poseł na Sejm RP VIII i IX kadencji,3,True,,,
330,Jarosław Sellin,PiS,1963-05-01,62,Gdynia,M,"Uniwersytet Gdański, Wydział Humanistyczno-Filologiczny, Historia - magister (1988) Uniwersytet Kardynała Stefana Wyszyńskiego, Historia - doktor (2021)",wyższe,doktor,0,nauczyciel akademicki,25,Gdańsk,pomorskie,7284,"poseł na Sejm RP V, VI, VII, VIII i IX kadencji",6,True,,,
331,Olga Ewa Semeniuk-Patkowska,PiS,1988-12-05,37,Warszawa,K,"Politechnika Warszawska, Wydział Administracji i Nauk Społecznych, Nauki Społeczne - magister (2019)",wyższe,magister,0,wyższy urzędnik państwowy,35,Olsztyn,warmińsko-mazurskie,14183,brak,1,True,,,
332,Edward Siarka,PiS,1963-07-07,62,Rabka,M,"Uniwersytet Jagielloński w Krakowie, Wydział Filozoficzno-Historyczny, Historia - magister (1988) Wyższa Szkoła Filozoficzno-Pedagogiczna IGNATIANUM, Doradztwo Europejskie (2004) - studia podyplomowe",wyższe,magister,1,nauczyciel,14,Nowy Sącz,małopolskie,18587,"poseł na Sejm RP V, VI, VII, VIII i IX kadencji",6,True,,,
333,Krystyna Sibińska,KO,1962-06-12,63,Złocieniec,K,"Politechnika Szczecińska, Wydział Budownictwa i Architektury, Technologia i Organizacja Budowy - magister inżynier (1987) Uniwersytet Szczeciński, Wydział Zarządzania i Ekonomiki Usług, Zarządzanie Funduszami Europejskimi (2004) - studia podyplomowe Uniwersytet Szczeciński, Wydział Prawa i Administracji, Prawo Administracyjne i Samorządowe (2007) - studia podyplomowe",wyższe,magister inżynier,2,inżynier budownictwa,8,Zielona Góra,lubuskie,19415,"poseł na Sejm RP VII, VIII i IX kadencji",4,True,,,
334,Czesław Siekierski,PSL,1952-10-08,73,Stopnica,M,"Szkoła Główna Gospodarstwa Wiejskiego w Warszawie, Wydział Rolniczy, Ekonomika Rolnictwa - magister inżynier (1976) Szkoła Główna Gospodarstwa Wiejskiego w Warszawie, Ekonomika Rolnictwa - doktor (1986)",wyższe,doktor,0,nauczyciel akademicki,33,Kielce,świętokrzyskie,21916,"poseł na Sejm RP III, IV i IX kadencji",4,True,,,
