id,imieNazwisko,klub,dataUr,wiek,miejsceUr,plec,ukonczonaSzkola,wyksztalcenie,najwyzszyStopienNaukowy,liczbaStudiowPodyplomowych,zawod,nrOkreguWyborczego,okregWyborczy,wojewodztwoOkreguWyborczego,liczbaGlosow,stazParlamentarny,ktoraKadencja,czyAktywny,powodNieaktywnosci,nieaktywnoscKomentarz,nieaktywnoscKategoria
335,Rafał Siemaszko,KO,1986-09-11,39,Wejherowo,M,"Zespół Szkół Budownictwa Okrętowego, Technikum Budowy Okrętów, Technik Budownictwa Okrętowego - technik (2006)",średnie zawodowe,,0,zawodnik dyscypliny sportu,26,Słupsk,pomorskie,15494,brak,1,True,,,
336,Tomasz Siemoniak,KO,1967-07-02,58,Wałbrzych,M,"Szkoła Główna Handlowa w Warszawie, Handel Zagraniczny, Ekonomika i Organizacja Handlu Zagranicznego - magister (1992)",wyższe,magister,0,ekonomista,21,Opole,opolskie,46223,poseł na Sejm RP VIII i IX kadencji,3,True,,,
337,Bartłomiej Sienkiewicz,KO,1961-07-29,64,Kielce,M,"Uniwersytet Jagielloński w Krakowie, Wydział Filozoficzno-Historyczny, Historia Archiwistyka - magister (1987)",wyższe,magister,0,"archiwista, historyk",13,Kraków,małopolskie,95873,poseł na Sejm RP IX kadencji,2,False,Zrzeczenie,Wybrany na posła do Parlamentu Europejskiego,Mandat w Parlamencie Europejskim
338,Arkadiusz Sikora,Lewica,1973-06-20,52,Głubczyce,M,"Uniwersytet Ekonomiczny we Wrocławiu, Wydział Gospodarki Narodowej, Finanse i Bankowość - magister (1997)",wyższe,magister,0,ekonomista,1,Legnica,dolnośląskie,12048,brak,1,True,,,
339,Włodzimierz Skalik,Konfederacja_KP,1959-06-10,66,Radomsko,M,"Policealne Studium Zawodowe TZN w Częstochowie, Obróbka Skrawaniem - technik (1980)",średnie policealne/pomaturalne,,0,przedsiębiorca,21,Opole,opolskie,15190,brak,1,True,,,
340,Marcin Skonieczka,Polska2050,1978-11-09,47,Chełmno,M,"Uniwersytet Ekonomiczny w Poznaniu, Wydział Zarządzania, Handel i Marketing - magister (2002) Uniwersytet Mikołaja Kopernika w Toruniu, Wiedzy o Unii Europejskiej i Wykorzystaniu Funduszy Europejskich (2008) - studia podyplomowe",wyższe,magister,1,"ekonomista, urzędnik samorządowy",5,Toruń,kujawsko-pomorskie,11864,brak,1,True,,,
341,Krystyna Skowrońska,KO,1954-07-22,71,Mielec,K,"Uniwersytet Marii Curie-Skłodowskiej w Lublinie, Wydział Prawa i Administracji, Prawo Administracyjne - magister (1978)",wyższe,magister,0,bankowiec,23,Rzeszów,podkarpackie,14901,"poseł na Sejm RP IV, V, VI, VII, VIII i IX kadencji",7,True,,,
342,Sławomir Skwarek,PiS,1963-11-25,62,Radzyń Podlaski,M,"Uniwersytet Warszawski, Wydział Historii, Historia - magister (1998) Katolicki Uniwersytet Lubelski, Zarządzanie Procesem Rozwoju Oświaty (2001) - studia podyplomowe",wyższe,magister,1,nauczyciel,6,Lublin,lubelskie,12427,poseł na Sejm RP VIII i IX kadencji,3,True,,,
343,Waldemar Sługocki,KO,1971-09-09,54,Sulechów,M,"Uniwersytet im. Adama Mickiewicza w Poznaniu, Wydział Nauk Społecznych, Nauki Polityczne i Dziennikarstwo - magister (1997) Uniwersytet im. Adama Mickiewicza w Poznaniu, Nauki Humanistyczne, Nauki o Polityce (2002) - studia doktoranckie Szkoła Główna Handlowa w Warszawie, Badania i Analizy Strategiczne (2011) - studia podyplomowe Uniwersytet im. Adama Mickiewicza w Poznaniu, Nauki Społeczne, Nauki o Polityce - doktor habilitowany (2014) Collegium Humanum - Szkoła Główna Menedżerska w Warszawie, Apsley Business School of London, Executive Master of Business Administration (2020) - studia podyplomowe",wyższe,doktor habilitowany,2,"nauczyciel akademicki, urzędnik",8,Zielona Góra,lubuskie,25037,"poseł na Sejm RP VII i IX kadencji, senator IX kadencji",3,True,,,
344,Weronika Smarduch,KO,1990-04-08,35,Rabka-Zdrój,K,"Uniwersytet Ekonomiczny w Krakowie, Wydział Zarządzania, Zarządzanie - magister (2014)",wyższe,magister,0,ekspert ds. kontrolingu,14,Nowy Sącz,małopolskie,27031,brak,1,True,,,
345,Kazimierz Smoliński,PiS,1955-07-15,70,Malbork,M,"Uniwersytet Gdański, Wydział Prawa i Administracji, Prawo - magister (1978) Uniwersytet im. Adama Mickiewicza w Poznaniu, Dla Radców Prawnych (1984) - studia podyplomowe Uniwersytet Gdański, Zarządzanie Przedsiębiorstwem (2001) - studia podyplomowe",wyższe,magister,2,adwokat,25,Gdańsk,pomorskie,16177,"poseł na Sejm RP VI, VII, VIII i IX kadencji",5,True,,,
346,Anna Sobolak,KO,1979-11-02,46,Lublin,K,"Politechnika Rzeszowska, Wydział Budowy Maszyn i Lotnictwa, Komputerowe Wspomaganie Procesów Technicznych - inżynier (2007)",wyższe,inżynier,0,przedsiębiorca,3,Wrocław,dolnośląskie,7675,brak,1,True,,,
347,Krzysztof Sobolewski,PiS,1978-09-20,47,Radymno,M,"Uniwersytet Marii Curie-Skłodowskiej w Lublinie, Wydział Prawa, Prawo Administracyjne - magister (2002)",wyższe,magister,0,administratywista,23,Rzeszów,podkarpackie,18390,poseł na Sejm RP IX kadencji,2,True,,,
348,Artur Soboń,PiS,1977-03-13,48,Świdnik,M,"Katolicki Uniwersytet Lubelski, Wydział Humanistyczny, Historia - magister (2001) Uniwersytet Marii Curie-Skłodowskiej w Lublinie, Zarządzanie Projektami Europejskimi i Prawo Unii Europejskiej (2004) - studia podyplomowe Katolicki Uniwersytet Lubelski, Rachunkowość i Finanse (2007) - studia podyplomowe Szkoła Główna Handlowa w Warszawie, Kolegium Nauk o Przedsiębiorstwie, Zarządzanie - magister (2011) Szkoła Główna Handlowa w Warszawie, Ekonomia (2011) - studia doktoranckie",wyższe,magister,2,pracownik samorządowy,6,Lublin,lubelskie,32357,poseł na Sejm RP VIII i IX kadencji,3,False,Zrzeczenie,Powołany na członka Zarządu Narodowego Banku Polskiego,Objęcie funkcji w administracji centralnej
349,Agnieszka Anna Soin,PiS,1977-02-09,48,Szczytno,K,"Uniwersytet Warmińsko-Mazurski w Olsztynie, Wydział Zarządzania i Administracji, Administracja - magister (2001) Politechnika Warszawska, Bezpieczeństwo i Higiena Pracy (2005) - studia podyplomowe Wyższa Szkoła Przedsiębiorczości i Zarządzania L. Koźmińskiego (Warszawa), Prawo Pracy (2007) - studia podyplomowe Szkoła Główna Handlowa w Warszawie, Doradztwo Zawodowe i Zarządzanie Kompetencjami (2008) - studia podyplomowe Szkoła Główna Handlowa w Warszawie, Public Relations i Komunikacji Strategicznej (2008) - studia podyplomowe Wyższa Szkoła Menedżerska akredytacja Aspley Business School of London, MBA (2019) - studia podyplomowe",wyższe,magister,5,parlamentarzysta,3,Wrocław,dolnośląskie,18645,poseł na Sejm RP VIII i IX kadencji,3,True,,,
350,Zbigniew Sosnowski,PSL,1963-12-10,62,Rypin,M,"Uniwersytet Mikołaja Kopernika w Toruniu, Wydział Nauk Historycznych, Historia - magister (2000)",wyższe,magister,0,nauczyciel,5,Toruń,kujawsko-pomorskie,27070,"poseł na Sejm RP IV, V, VII i VIII kadencji",5,True,,,
351,Marek Sowa,KO,1967-02-04,58,Libiąż,M,"Akademia Górniczo-Hutnicza w Krakowie, Wydział Zarządzania, Zarządzanie - magister (2002)",wyższe,magister,0,wyższy urzędnik państwowy,12,Kraków,małopolskie,24652,poseł na Sejm RP VIII i IX kadencji,3,True,,,
352,Katarzyna Sójka,PiS,1986-02-05,39,Ostrów Wielkopolski,K,"Wydział Lekarski, Lekarski - lekarz (2011) Uniwersytet Przyrodniczy w Poznaniu, Wydział Leśny - Gospodarka Leśna, Inżynier Leśnictwa - inżynier (2013)",wyższe,lekarz,0,lekarz - specjalista chorób wewnętrznych,36,Kalisz,wielkopolskie,18138,poseł na Sejm RP IX kadencji,2,True,,,
353,Magdalena Sroka,PSL,1979-07-15,46,Gdańsk,K,"Akademia Wychowania Fizycznego w Gdańsku, Wydział Wychowania Fizycznego, Nauczyciel Wychowania Fizycznego - magister (2003) Uniwersytet Gdański, Wydział Zarządzania, Zarządzanie Zasobami Ludzkimi (2006) - studia podyplomowe Wyższa Szkoła Policji w Szczytnie, Studia Oficerskie (2009) - studia podyplomowe Wyższa Szkoła Handlu i Usług w Poznaniu, Wydział Społeczno-Ekonomiczny, Menedżer (2019)",wyższe,magister,2,menedżer,25,Gdańsk,pomorskie,18348,poseł na Sejm RP IX kadencji,2,True,,,
354,Mirosława Stachowiak-Różecka,PiS,1973-07-08,52,Świebodzin,K,"Dolnośląska Szkoła Wyższa, Wydział Nauk Pedagogicznych, Pedagogika Specjalna - magister (2017)",wyższe,magister,0,pedagog specjalny,3,Wrocław,dolnośląskie,97193,poseł na Sejm RP VIII i IX kadencji,3,True,,,
355,Dariusz Stefaniuk,PiS,1981-05-10,44,Biała Podlaska,M,"Uniwersytet Kardynała Stefana Wyszyńskiego w Warszawie, Wydział Nauk Historycznych i Społecznych, Politologia - magister (2006) Szkoła Główna Handlowa w Warszawie, Podyplomowe Studia Menadżerskie (2009) - studia podyplomowe Szkoła Główna Handlowa w Warszawie, Menadżer Samorządu Terytorialnego (2017) - studia podyplomowe",wyższe,magister,2,politolog,7,Chełm,lubelskie,29710,poseł na Sejm RP IX kadencji,2,True,,,
356,Franciszek Sterczewski,KO,1988-03-17,37,Poznań,M,"Uniwersytet Artystyczny w Poznaniu, Wydział Architektury i Wzornictwa, Architektura i Urbanistyka - inżynier architekt (2014)",wyższe,inżynier,0,architekt,39,Poznań,wielkopolskie,10108,poseł na Sejm RP IX kadencji,2,True,,,
357,Piotr Paweł Strach,Polska2050,1982-01-10,44,Częstochowa,M,"Politechnika Częstochowska, Wydział Zarządzania, Marketing i Zarządzanie - magister (2009) Collegium Humanum Wrocław, Executive Master of Business Administration (EMBA) (2021) - studia podyplomowe",wyższe,magister,1,"menedżer, nauczyciel",29,Katowice,śląskie,17634,brak,1,True,,,
358,Mirosław Suchoń,Polska2050,1976-01-10,50,Bielsko-Biała,M,"Wyższa Szkoła Bankowa w Poznaniu, Wydział Zamiejscowy w Chorzowie, Finanse i Bankowość - licencjat (2000)",wyższe,licencjat,0,"ekonomista, informatyk",27,Bielsko-Biała,śląskie,30897,poseł na Sejm RP VIII i IX kadencji,3,True,,,
359,Marek Suski,PiS,1958-06-11,67,Grójec,M,"Pomaturalne Studium Zawodowe, Technik Teatralny (1980)",średnie policealne/pomaturalne,,0,specjalista ds. marketingu,17,Radom,mazowieckie,37853,"poseł na Sejm RP IV, V, VI, VII, VIII i IX kadencji",7,True,,,
360,Paweł Suski,KO,1964-06-10,61,Wałcz,M,"Akademia Rolnicza w Poznaniu, Wydział Ogrodniczy - magister inżynier (1989)",wyższe,magister inżynier,0,parlamentarzysta,40,Koszalin,zachodniopomorskie,5934,"poseł na Sejm RP VI, VII i VIII kadencji",4,True,,,
361,Artur Szałabawka,PiS,1967-10-03,58,Szczecin,M,"Uniwersytet Szczeciński, Wydział Humanistyczny, Politologia i Nauki Społeczne w Zakresie Socjologii - magister (2001)",wyższe,magister,0,pracownik administracji państwowej,41,Szczecin,zachodniopomorskie,15446,poseł na Sejm RP VIII i IX kadencji,3,True,,,
362,Wojciech Szarama,PiS,1955-12-16,70,Bytom,M,"Uniwersytet Śląski, Wydział Prawa, Prawo - magister (1983)",wyższe,magister,0,adwokat,29,Katowice,śląskie,12185,"poseł na Sejm RP IV, V, VI, VII, VIII i IX kadencji",7,True,,,
363,Wiesław Szczepański,Lewica,1960-06-01,65,Chrośnica,M,"Akademia Ekonomiczna w Poznaniu, Wydział Organizacji i Zarządzania, Organizacja i Zarządzanie - magister (1983)",wyższe,magister,0,ekonomista,36,Kalisz,wielkopolskie,13668,"poseł na Sejm RP II, III, V, VI i IX kadencji",6,True,,,
364,Michał Szczerba,KO,1977-12-14,48,Warszawa,M,"Uniwersytet Warszawski, Instytut Stosowanych Nauk Społecznych, Socjologia (2001) Szkoła Główna Handlowa w Warszawie, Europejskie Studia Finansowania Inwestycji w Samorządzie Terytorialnym (2004) - studia podyplomowe",wyższe,magister,1,urzędnik państwowy,19,Warszawa,mazowieckie,28653,"poseł na Sejm RP VI, VII, VIII i IX kadencji",5,False,Zrzeczenie,Wybrany na posła do Parlamentu Europejskiego,Mandat w Parlamencie Europejskim
365,Krzysztof Szczucki,PiS,1986-10-18,39,Elbląg,M,"Uniwersytet Warszawski, Wydział Prawa i Administracji, Prawo - magister (2010) Uniwersytet Warszawski, Nauki Prawne (2014) - studia doktoranckie Uniwersytet Warszawski, Nauki Humanistyczne - doktor habilitowany (2021)",wyższe,doktor habilitowany,0,prawnik,5,Toruń,kujawsko-pomorskie,34014,brak,1,True,,,
366,Józefa Szczurek-Żelazko,PiS,1961-03-14,64,Nowy Sącz,K,"Akademia Medyczna w Lublinie, Wydział Pielęgniarski - magister (1994) Politechnika Krakowska, Audyt Wewnętrzny Jednostek Sektora Finansów Publicznych (2004) - studia podyplomowe",wyższe,magister,1,"menedżer, parlamentarzysta",15,Tarnów,małopolskie,26231,poseł na Sejm RP VIII i IX kadencji,3,True,,,
367,Paweł Szefernaker,PiS,1987-02-27,38,Szczecin,M,"Europejska Wyższa Szkoła Prawa i Administracji (Warszawa), Wydział Prawa, Prawo - magister (2011)",wyższe,magister,0,prawnik,40,Koszalin,zachodniopomorskie,29764,poseł na Sejm RP VIII i IX kadencji,3,False,Zrzeczenie,Powołany na stanowisko Sekretarza Stanu - Szefa Gabinetu Prezydenta RP,Objęcie funkcji w administracji centralnej
368,Andrzej Szejna,Lewica,1973-04-28,52,Końskie,M,"Szkoła Główna Handlowa w Warszawie, Finanse i Bankowość, Ekonomia - magister (1996) Uniwersytet Warszawski, Wydział Prawa i Administracji, Prawo - magister (1997)",wyższe,magister,0,adwokat,33,Kielce,świętokrzyskie,17961,poseł na Sejm RP IX kadencji,2,True,,,
369,Andrzej Szewiński,KO,1970-02-20,55,Warszawa,M,"Uniwersytet Humanistyczno-Przyrodniczy w Częstochowie, Wydział Pedagogiczny, Pedagogika z Wychowaniem Fizycznym - magister (1994) Akademia WSB w Dąbrowie Górniczej, Executive MBA (2018) - studia podyplomowe",wyższe,magister,1,"parlamentarzysta, pedagog, przedsiębiorca prywatny, sportowiec, urzędnik samorządowy",28,Częstochowa,śląskie,10171,"poseł na Sejm RP IX kadencji, senator VII i VIII kadencji",2,True,,,
370,Adam Szłapka,KO,1984-12-06,41,Kościan,M,"Uniwersytet im. Adama Mickiewicza w Poznaniu, Wydział Nauk Politycznych i Dziennikarstwa, Politologia - magister (2008) Polski Instytut Spraw Międzynarodowych, Studium Polityki Zagranicznej (2012) - studia podyplomowe",wyższe,magister,1,politolog,39,Poznań,wielkopolskie,149064,poseł na Sejm RP VIII i IX kadencji,3,True,,,
371,Henryk Szopiński,KO,1962-09-15,63,Złotów,M,"Bałtycka Wyższa Szkoła Humanistyczna w Koszalinie, Wydział Administracji, Administracja Publiczna - magister (2008)",wyższe,magister,0,"animator kultury, muzyk",38,Piła,wielkopolskie,8263,brak,1,True,,,
372,Paweł Szrot,PiS,1975-06-30,50,Białystok,M,"Uniwersytet Warszawski, Wydział Prawa i Administracji, Prawo - magister (1999)",wyższe,magister,0,"prawnik, wyższy urzędnik państwowy",4,Bydgoszcz,kujawsko-pomorskie,20214,brak,1,True,,,
373,Krystyna Szumilas,KO,1956-06-28,69,Knurów,K,"Uniwersytet Śląski, Wydział Matematyki, Fizyki i Chemii, Matematyka - magister (1983) Uniwersytet Śląski, Informatyka (1988) - studia podyplomowe Szkoła Zarządzania Uniwersytetu Śląskiego, Zarządzanie Zasobami Ludzkimi (1999) - studia podyplomowe Uniwersytet Śląski, Samorząd Terytorialny (1999) - studia podyplomowe",wyższe,magister,3,nauczyciel,29,Katowice,śląskie,50871,"poseł na Sejm RP IV, V, VI, VII, VIII i IX kadencji",7,True,,,
374,Stanisław Szwed,PiS,1955-04-12,70,Bielsko-Biała,M,"Krakowska Szkoła Wyższa im. A. F. Modrzewskiego, Wydział Prawa i Administracji, Administracja Publiczna - magister (2006)",wyższe,magister,0,parlamentarzysta,27,Bielsko-Biała,śląskie,57055,"poseł na Sejm RP III, V, VI, VII, VIII i IX kadencji",7,True,,,
375,Ewa Szymanowska,Polska2050,1978-05-30,47,Łódź,K,"Uniwersytet Łódzki, Wydział Zarządzania, Marketing i Zarządzanie - magister (2002) Uniwersytet Łódzki, Wydział Ekonomiczno-Socjologiczny, Public Relations (2010)",wyższe,magister,0,"menedżer marketingu, public relations",9,Łódź,łódzkie,26185,brak,1,True,,,
376,Tomasz Szymański,KO,1978-04-24,47,Grudziądz,M,"Uniwersytet Mikołaja Kopernika w Toruniu, Wydział Prawa i Administracji, Administracja - magister (2003) Uniwersytet Gdański, Zarządzanie Zasobami Ludzkimi (2008) - studia podyplomowe",wyższe,magister,1,"parlamentarzysta, pracownik administracji samorządowej",5,Toruń,kujawsko-pomorskie,17825,"poseł na Sejm RP VII, VIII i IX kadencji",4,True,,,
377,Szymon Szynkowski vel Sęk,PiS,1982-11-24,43,Poznań,M,"Uniwersytet im. Adama Mickiewicza w Poznaniu, Wydział Prawa i Administracji, Stosunki Międzynarodowe - magister (2006)",wyższe,magister,0,wyższy urzędnik państwowy,39,Poznań,wielkopolskie,45167,poseł na Sejm RP VIII i IX kadencji,3,True,,,
378,Łukasz Ściebiorowski,KO,1980-03-13,45,Piekary Śląskie,M,"Uniwersytet Śląski, Wydział Nauk Społecznych, Politologia - magister (2005)",wyższe,magister,0,politolog,31,Katowice,śląskie,7116,brak,1,True,,,
379,Agnieszka Ścigaj,PiS,1975-12-22,50,Kraków,K,"Uniwersytet Śląski, Wydział Nauk Społecznych, Socjologia - magister (2001) Uniwersytet Ekonomiczny w Krakowie, Ekonomia Społeczna (2011) - studia podyplomowe",wyższe,magister,1,"doradca, pracownik socjalny, wykładowca",13,Kraków,małopolskie,6262,poseł na Sejm RP VIII i IX kadencji,3,True,,,
380,Andrzej Śliwka,PiS,1988-10-12,37,Pasłęk,M,"Uniwersytet Gdański, Podatki i Prawo Podatkowe (2015) - studia podyplomowe Okręgowa Izba Radców Prawnych w Warszawie, Aplikacja Radcowska (2018) Uniwersytet Gdański, Wydział Prawa i Administracji, Prawo - magister",wyższe,magister,1,radca prawny,34,Elbląg,warmińsko-mazurskie,32895,brak,1,True,,,
381,Paweł Śliz,Polska2050,1980-09-18,45,Kraków,M,"Uniwersytet Jagielloński w Krakowie, Wydział Prawa i Administracji, Prawo - magister (2005)",wyższe,magister,0,adwokat,12,Kraków,małopolskie,19630,brak,1,True,,,
382,Krzysztof Śmiszek,Lewica,1979-08-25,46,Stalowa Wola,M,"Uniwersytet Warszawski, Wydział Prawa i Administracji, Prawo i Administracja - magister (2003) Uniwersytet Warszawski, Prawo Europejskie (2006) - studia podyplomowe Uniwersytet Warszawski, Wydział Prawa i Administracji, Prawo - doktor (2016)",wyższe,doktor,1,prawnik,3,Wrocław,dolnośląskie,34577,poseł na Sejm RP IX kadencji,2,False,Zrzeczenie,Wybrany na posła do Parlamentu Europejskiego,Mandat w Parlamencie Europejskim
383,Jacek Świat,PiS,1955-12-16,70,Wrocław,M,"Uniwersytet Wrocławski, Wydział Filologiczny, Filologia Polska (1980)",wyższe,magister,0,"parlamentarzysta, specjalista ds. marketingu",3,Wrocław,dolnośląskie,13663,"poseł na Sejm RP VII, VIII i IX kadencji",4,True,,,
384,Apoloniusz Tajner,KO,1954-04-17,71,Cieszyn,M,"Akademia Wychowania Fizycznego w Krakowie, Wydział Nauczycielski, Wychowanie Fizyczne - magister (1980)",wyższe,magister,0,"nauczyciel, trener",27,Bielsko-Biała,śląskie,20748,brak,1,True,,,
385,Krzysztof Tchórzewski,PiS,1950-05-19,75,Rzążew,M,"Politechnika Warszawska, Wydział Elektryczny, Zabezpieczenia Elektroenergetyczne - magister inżynier (1974)",wyższe,magister inżynier,0,"ekonomista, inżynier elektryk",18,Siedlce,mazowieckie,25867,"poseł na Sejm RP I, III, V, VI, VII, VIII i IX kadencji",8,True,,,
386,Robert Telus,PiS,1969-04-18,56,Opoczno,M,"Politechnika Krakowska, Wydział Inżynierii Środowiska, Ochrona środowiska - inżynier (1996) Collegium Humanum, MBA (2021) - studia podyplomowe",wyższe,inżynier,1,urzędnik państwowy,10,Piotrków Trybunalski,łódzkie,49262,"poseł na Sejm RP VI, VII, VIII i IX kadencji",5,True,,,
387,Ryszard Terlecki,PiS,1949-09-02,76,Kraków,M,"Uniwersytet Jagielloński w Krakowie, Wydział Filozoficzno-Historyczny, Historia - magister (1976) Uniwersytet Jagielloński w Krakowie, Wydział Filozoficzno-Historyczny, Nauki Humanistyczne - doktor (1980) Rada Naukowa Instytutu Historii, Nauki, Oświaty i Techniki PAN, Nauki Humanistyczne - doktor habilitowany (1992)",wyższe,doktor,0,historyk,14,Nowy Sącz,małopolskie,29882,"poseł na Sejm RP VI, VII, VIII i IX kadencji",5,True,,,
388,Tadeusz Tomaszewski,Lewica,1959-02-21,66,Niechanowo,M,"Wyższa Szkoła Umiejętności Społecznych, Marketing i Zarządzanie, Ekonomia - licencjat (2000)",wyższe,licencjat,0,ekonomista,37,Konin,wielkopolskie,17181,"poseł na Sejm RP II, III, IV, V, VI, VII i IX kadencji",8,True,,,
389,Jacek Tomczak,PSL,1973-07-27,52,Poznań,M,"Uniwersytet im. Adama Mickiewicza w Poznaniu, Wydział Prawa, Prawo - magister (1998)",wyższe,magister,0,"notariusz, radca prawny",39,Poznań,wielkopolskie,24918,"poseł na Sejm RP V, VI, VII, VIII i IX kadencji",6,True,,,
390,Wioleta Tomczak,Polska2050,1988-04-21,37,Gdynia,K,"Gdański Uniwersytet Medyczny, Wydział Nauk o Zdrowiu, Zdrowie Publiczne - magister (2012) Gdański Uniwersytet Medyczny, Nauki o Zdrowiu (2021) - studia doktoranckie",wyższe,magister,0,specjalista ds. zdrowia publicznego,26,Słupsk,pomorskie,13217,brak,1,True,,,
391,Cezary Tomczyk,KO,1984-08-25,41,Gryfice,M,"Uniwersytet Warszawski, Wydział Dziennikarstwa i Nauk Politycznych, Marketing Polityczny - magister (2008)",wyższe,magister,0,politolog,11,Sieradz,łódzkie,69211,"poseł na Sejm RP VI, VII, VIII i IX kadencji",5,True,,,
392,Stanisław Tomczyszyn,PSL,1959-08-26,66,Żagań,M,"Wyższa Szkoła Pedagogiczna w Zielonej Górze, Wydział Humanistyczny, Historia - magister (1983) Wyższa Szkoła Pedagogiczna w Zielonej Górze, Historia (1987) - studia podyplomowe Politechnika Zielonogórska, Organizacja i Zarządzanie Szkołą (2001) - studia podyplomowe Wyższa Szkoła Bankowa w Poznaniu, Wydział Finansów i Bankowości, Administracja (2003) - studia podyplomowe",wyższe,magister,3,nauczyciel,8,Zielona Góra,lubuskie,10332,brak,1,True,,,
393,Małgorzata Tracz,KO,1985-12-08,40,Bolesławiec,K,"Uniwersytet Wrocławski, Wydział Filologiczny, Filologia Polska - magister (2009) Uniwersytet Wrocławski, Wydział Nauk Społecznych, Stosunki Międzynarodowe - licencjat (2009)",wyższe,magister,0,"filolog, specjalista ds. szkoleń",3,Wrocław,dolnośląskie,17693,poseł na Sejm RP IX kadencji,2,True,,,
394,Tomasz Trela,Lewica,1979-12-30,46,Łódź,M,"Politechnika Łódzka, Wydział Organizacji i Zarządzania, Zarządzanie Przedsiębiorstwem - magister (2003) Uniwersytet Łódzki, Podyplomowe Studium Finansów i Strategii Spółek (2008) - studia podyplomowe",wyższe,magister,1,ekonomista,9,Łódź,łódzkie,26273,poseł na Sejm RP IX kadencji,2,True,,,
395,Krzysztof Truskolaski,KO,1990-07-25,35,Białystok,M,"Uniwersytet w Białymstoku, Wydział Ekonomii i Zarządzania, Ekonomia - magister (2014) Uniwersytet w Białymstoku, Wydział Ekonomii i Zarządzania, Zarządzanie - magister (2019)",wyższe,magister,0,ekonomista,24,Białystok,podlaskie,57664,poseł na Sejm RP VIII i IX kadencji,3,True,,,
396,Krzysztof Tuduj,Konfederacja,1981-04-25,44,Warszawa,M,"Uniwersytet Wrocławski, Wydział Prawa, Administracji i Ekonomii, Prawo - magister (2010) Akademia Wojsk Lądowych we Wrocławiu, Zarządzanie Kryzysowe (2017) - studia podyplomowe Akademia Sztuki Wojennej w Warszawie, Służby Specjalne (2021) - studia podyplomowe",wyższe,magister,2,prawnik,3,Wrocław,dolnośląskie,25922,poseł na Sejm RP IX kadencji,2,True,,,
397,Sylwester Tułajew,PiS,1981-12-30,44,Lublin,M,"Politechnika Lubelska, Wydział Elektrotechniki i Informatyki, Elektrotechnika - magister inżynier (2005) Wyższa Szkoła Przedsiębiorczości i Administracji, Zarządzanie w Administracji i Samorządzie Terytorialnym (2006) - studia podyplomowe",wyższe,magister inżynier,1,informatyk,6,Lublin,lubelskie,10228,poseł na Sejm RP VIII i IX kadencji,3,True,,,
398,Witold Tumanowicz,Konfederacja,1986-11-04,39,Lublin,M,XLVII LO im. Stanisława Wyspiańskiego w Warszawie (2005),średnie ogólne,,0,zawodowy działacz organizacji polityczne,7,Chełm,lubelskie,14387,brak,1,True,,,
399,Donald Tusk,KO,1957-04-22,68,Gdańsk,M,"Uniwersytet Gdański, Wydział Humanistyczny, Historia - magister (1980)",wyższe,magister,0,nauczyciel,19,Warszawa,mazowieckie,538634,"poseł na Sejm RP I, IV, V, VI i VII kadencji, senator IV kadencji",6,True,,,
400,Stanisław Tyszka,Konfederacja,1979-04-11,46,Warszawa,M,"Uniwersytet Warszawski, Wydział Prawa i Administracji, Prawo - magister (2004) Europejski Instytut Uniwersytecki we Florencji, Wydział Historii, Nauki Humanistyczne - doktor (2011)",wyższe,doktor,0,nauczyciel akademicki,26,Słupsk,pomorskie,19753,poseł na Sejm RP VIII i IX kadencji,3,False,Zrzeczenie,Wybrany na posła do Parlamentu Europejskiego,Mandat w Parlamencie Europejskim
401,Katarzyna Ueberhan,Lewica,1975-08-26,50,Poznań,K,"Uniwersytet im. Adama Mickiewicza w Poznaniu, Wydział Nauk Społecznych, Filozofia - Życie Publiczne - magister (2009)",wyższe,magister,0,filozof,39,Poznań,wielkopolskie,24485,poseł na Sejm RP IX kadencji,2,True,,,
402,Jarosław Urbaniak,KO,1966-08-07,59,Ostrów Wielkopolski,M,"Katolicki Uniwersytet Lubelski, Wydział Filozofii, Filozofia Teoretyczna - magister (1991) Uniwersytet Warszawski, Wydział Zarządzania, Zarządzanie - magister (1999)",wyższe,magister,0,menedżer,36,Kalisz,wielkopolskie,50724,"poseł na Sejm RP V, VI, VIII i IX kadencji",5,True,,,
403,Piotr Uruski,PiS,1976-08-11,49,Sanok,M,"Uniwersytet Jagielloński w Krakowie, Wydział Historyczny, Historia - magister (2001) Uniwersytet Rzeszowski, Nauki Humanistyczne - doktor (2007) Wyższa Szkoła Menedżerska w Warszawie, Executive Master of Business Administration (2018) - studia podyplomowe",wyższe,doktor,1,"historyk, nauczyciel akademicki",22,Krosno,podkarpackie,22703,poseł na Sejm RP VIII i IX kadencji,3,True,,,
404,Piotr Uściński,PiS,1977-05-20,48,Warszawa,M,"Politechnika Warszawska, Wydział Elektroniki i Technik Informacyjnych, Elektronika - Inżynieria Komputerowa - magister inżynier (2004) Szkoła Główna Handlowa w Warszawie, Nauki o Zarządzaniu (2006) - studia podyplomowe Akademia Leona Koźmińskiego, Psychologia Biznesu (2010) - studia podyplomowe Collegium Humanum, MBA (2021) - studia podyplomowe",wyższe,magister inżynier,3,"elektronik, menedżer, parlamentarzysta",20,Warszawa,mazowieckie,15006,poseł na Sejm RP VIII i IX kadencji,3,True,,,
405,Jarosław Wałęsa,KO,1976-09-13,49,Gdańsk,M,"Uniwersytet Świętego Krzyża, Worcester Massachusetts USA, Politologia - licencjat (2000) Uniwersytet Gdański, Politologia, Europeistyka i Przemiany Globalne - magister (2014)",wyższe,magister,0,politolog,25,Gdańsk,pomorskie,17408,"poseł na Sejm RP V, VI i IX kadencji",4,True,,,
