id,imieNazwisko,klub,dataUr,wiek,miejsceUr,plec,ukonczonaSzkola,wyksztalcenie,najwyzszyStopienNaukowy,liczbaStudiowPodyplomowych,zawod,nrOkreguWyborczego,okregWyborczy,wojewodztwoOkreguWyborczego,liczbaGlosow,stazParlamentarny,ktoraKadencja,czyAktywny,powodNieaktywnosci,nieaktywnoscKomentarz,nieaktywnoscKategoria
0,Andrzej Adamczyk,PiS,1959-01-04,67,Krzeszowice,M,"Społeczna Akademia Nauk w Łodzi, Wydział Zarządzania, Rachunkowość i Finanse w Zarządzaniu - licencjat (2014)",wyższe,licencjat,0,ekonomista,13,Kraków,małopolskie,45171,"poseł na Sejm RP V, VI, VII, VIII i IX kadencji",6,True,,,
1,Piotr Adamowicz,KO,1961-06-26,64,Elbląg,M,VI Liceum Ogólnokształcące w Gdańsku (1980),średnie ogólne,,0,dziennikarz,25,Gdańsk,pomorskie,23147,poseł na Sejm RP IX kadencji,2,True,,,
2,Adam Andruszkiewicz,PiS,1990-06-30,35,Grajewo,M,"Uniwersytet w Białymstoku, Wydział Historyczno-Socjologiczny, Stosunki Międzynarodowe - magister (2014)",wyższe,magister,0,parlamentarzysta,24,Białystok,podlaskie,53632,poseł na Sejm RP VIII i IX kadencji,3,False,Zrzeczenie,Powołany na stanowisko Sekretarza Stanu i Zastępcy Szefa Kancelarii Prezydenta RP,Objęcie funkcji w administracji centralnej
3,Waldemar Andzel,PiS,1971-09-17,54,Czeladź,M,"Uniwersytet Śląski w Katowicach, Wydział Nauk Społecznych, Politologia - magister (1996) Uniwersytet Śląski, Organizacja Pomocy Społecznej (1999) - studia podyplomowe Akademia WSB w Dąbrowie Górniczej, MBA (2018) - studia podyplomowe",wyższe,magister,2,politolog,32,Katowice,śląskie,22699,"poseł na Sejm RP V, VI, VII, VIII i IX kadencji",6,True,,,
4,Dorota Arciszewska-Mielewczyk,PiS,1968-02-16,57,Gdynia,K,"Uniwersytet Gdański, Wydział Ekonomiki Transportu, Ekonomia - magister (1992) Wyższa Szkoła Morska w Gdyni, Wydział Administracji, Organizacja i eksploatacja statków i portów - magister (1994) Wyższa Szkoła Handlu i Usług w Poznaniu, Executive MBA Master of Business Administration (2020) - studia podyplomowe",wyższe,magister,1,"ekonomista, menedżer",26,Słupsk,pomorskie,11766,"poseł na Sejm RP III, IV, VII i VIII kadencji, senator VI i VII kadencji",5,True,,,
5,Jan Krzysztof Ardanowski,Republikanie,1961-02-11,64,Czernikowo,M,"Akademia Techniczno-Rolnicza w Bydgoszczy, Wydział Rolniczy, Rolnictwo - magister inżynier (1985)",wyższe,magister inżynier,0,rolnik,5,Toruń,kujawsko-pomorskie,28658,"poseł na Sejm RP VII, VIII i IX kadencji",4,True,,,
6,Iwona Ewa Arent,PiS,1968-06-04,57,Olsztyn,K,"Wyższa Szkoła Pedagogiczna, Wydział Humanistyczny, Politologia i Nauki Społeczne - magister (1999) Uniwersytet Warmińsko-Mazurski, Rachunkowość (2002) - studia podyplomowe Collegium Civitas pod patronatem Studiów Politycznych PAN, Stosunki Międzynarodowe i Dyplomacja (2012) - studia podyplomowe WSHIU Akademia Nauk Stosowanych w Poznaniu, EMBA (2023) - studia podyplomowe",wyższe,magister,3,politolog,35,Olsztyn,warmińsko-mazurskie,16675,"poseł na Sejm RP V, VI, VII, VIII i IX kadencji",6,True,,,
7,Bartosz Arłukowicz,KO,1971-12-30,54,Resko,M,"Pomorski Uniwersytet Medyczny, Wydział Lekarski, Lekarski - lekarz (1996) Uniwersytet Szczeciński, MBA (2007) - studia podyplomowe",wyższe,lekarz,1,lekarz,40,Koszalin,zachodniopomorskie,67325,"poseł na Sejm RP VI, VII i VIII kadencji",4,False,Zrzeczenie,Wybrany na posła do Parlamentu Europejskiego,Mandat w Parlamencie Europejskim
8,Marek Ast,PiS,1958-09-27,67,Zielona Góra,M,"Uniwersytet Wrocławski, Wydział Prawa i Administracji, Prawo - magister (1984)",wyższe,magister,0,"pracownik samorządowy, radca prawny, urzędnik państwowy",8,Zielona Góra,lubuskie,36365,"poseł na Sejm RP V, VI, VII, VIII i IX kadencji",6,True,,,
9,Urszula Augustyn,KO,1964-09-01,61,Tarnów,K,"Wyższa Szkoła Pedagogiczna, Wydział Filologii Polskiej, Filologia Polska - magister (1990)",wyższe,magister,0,dziennikarz,15,Tarnów,małopolskie,27047,"poseł na Sejm RP V, VI, VII, VIII i IX kadencji",6,True,,,
10,Piotr Babinetz,PiS,1969-09-09,56,Krosno,M,"Uniwersytet Wrocławski, Wydział Nauk Historycznych i Pedagogicznych, Historia - magister (2007)",wyższe,magister,0,"historyk, muzealnik",22,Krosno,podkarpackie,12829,"poseł na Sejm RP VI, VII, VIII i IX kadencji",5,True,,,
11,Ryszard Bartosik,PiS,1968-01-11,58,Turek,M,"Uniwersytet im. Adama Mickiewicza w Poznaniu, Wydział Nauk Politycznych i Dziennikarstwa, Politologia - magister (2011)",wyższe,magister,0,politolog,37,Konin,wielkopolskie,25371,poseł na Sejm RP VIII i IX kadencji,3,True,,,
12,Władysław Bartoszewski,PSL,1955-10-22,70,Warszawa,M,"Uniwersytet Warszawski, Wydział Historyczny, Etnografia - magister (1980) University of Cambridge, Wielka Brytania, Antropologia Społeczna - doktor - samodzielny pracownik naukowy (1984)",wyższe,doktor,0,pracownik naukowy,19,Warszawa,mazowieckie,34563,poseł na Sejm RP IX kadencji,2,True,,,
13,Barbara Bartuś,PiS,1967-07-03,58,Gorlice,K,"Uniwersytet Marii Curie-Skłodowskiej w Lublinie, Wydział Prawa i Administracji, Administracja - magister (2000) Uniwersytet Rzeszowski, Wydział Prawa, Prawo - magister (2003)",wyższe,magister,0,prawnik,14,Nowy Sącz,małopolskie,21250,"poseł na Sejm RP VI, VII, VIII i IX kadencji",5,True,,,
14,Paweł Bejda,PSL,1962-10-13,63,Łowicz,M,"Akademia Rolniczo-Techniczna w Olsztynie, Wydział Mechaniczny, Technologia Maszyn - magister inżynier (1987) Politechnika Łódzka, Wydział Organizacji i Zarządzania, Menedżerskie (2001) - studia podyplomowe Wojskowa Akademia Techniczna w Warszawie, Zarządzanie Nieruchomościami. Pośrednictwo w obrocie nieruchomościami (2009) - studia podyplomowe",wyższe,magister inżynier,2,"inżynier mechanik, menedżer",11,Sieradz,łódzkie,25363,poseł na Sejm RP VIII i IX kadencji,3,True,,,
15,Konrad Berkowicz,Konfederacja,1984-05-27,41,Kraków,M,"Uniwersytet Warszawski, Wydział Filozofii, Filozofia - magister (2023)",wyższe,magister,0,programista,13,Kraków,małopolskie,36918,poseł na Sejm RP IX kadencji,2,True,,,
16,Sylwia Bielawska,KO,1975-04-27,50,Głuszyca,K,"Wyższa Szkoła Pedagogiczna im. T. Kotarbińskiego w Zielonej Górze, Wydział Humanistyczny, Filologia Polska - licencjat (1997) Wyższa Szkoła Pedagogiczna im. T. Kotarbińskiego w Zielonej Górze, Wydział Humanistyczny, Filologia Polska - magister (1999) Uniwersytet im. Adama Mickiewicza w Poznaniu, Edytorstwo (2003) - studia podyplomowe Uniwersytet Wrocławski, Bibliologia - doktor (2010) Uniwersytet Ekonomiczny w Krakowie - Krakowska Szkoła Biznesu, MBA in Community Management (2020) - studia podyplomowe Wyższa Szkoła Bankowa w Poznaniu, Doradztwo Zawodowe i Coaching Kariery (2022) - studia podyplomowe",wyższe,doktor,3,pracownik samorządowy,2,Wałbrzych,dolnośląskie,17577,brak,1,True,,,
17,Marek Biernacki,PSL,1959-04-28,66,Sopot,M,"Uniwersytet Gdański, Wydział Prawa i Administracji, Prawo - magister (1985)",wyższe,magister,0,prawnik,26,Słupsk,pomorskie,34369,"poseł na Sejm RP III, V, VI, VII, VIII i IX kadencji",7,True,,,
18,Paweł Bliźniuk,KO,1986-10-11,39,Łódź,M,XXI LO im. Bolesława Prusa w Łodzi,średnie ogólne,,0,pracownik administracji samorządowej,9,Łódź,łódzkie,12315,brak,1,True,,,
19,Mariusz Błaszczak,PiS,1969-09-19,56,Legionowo,M,"Uniwersytet Warszawski, Wydział Historyczny, Historia - magister (1995) Uniwersytet Warszawski, Samorząd Terytorialny i Rozwój Lokalny (1998) - studia podyplomowe Słuchacz KSAP IX Promocji (2001) - studia podyplomowe",wyższe,magister,2,urzędnik państwowy,20,Warszawa,mazowieckie,127578,"poseł na Sejm RP VI, VII, VIII i IX kadencji",5,True,,,
20,Mateusz Bochenek,KO,1993-03-12,32,Sosnowiec,M,"Uniwersytet Śląski, Wydział Nauk Społecznych, Nauki Społeczne - licencjat (2015) Uniwersytet Śląski, Wydział Nauk Społecznych, Nauki Humanistyczne - magister (2018) Akademia WSB w Dąbrowie Górniczej, MBA, MBA (2018) - studia podyplomowe",wyższe,magister,1,parlamentarzysta,32,Katowice,śląskie,15117,poseł na Sejm RP IX kadencji,2,True,,,
21,Rafał Bochenek,PiS,1986-08-14,39,Kraków,M,"Uniwersytet Jagielloński w Krakowie, Wydział Prawa i Administracji, Prawo - magister (2011) Krakowska Izba Notarialna, Aplikacja Notarialna (2014) Krakowska Szkoła Biznesu przy Uniwersytecie Ekonomicznym, MBA (2019) - studia podyplomowe",wyższe,magister,1,prawnik,12,Kraków,małopolskie,42142,poseł na Sejm RP IX kadencji,2,True,,,
22,Izabela Bodnar,niez.,1975-02-13,50,Lubliniec,K,"Wyższa Szkoła Bankowa we Wrocławiu, Bankowość - licencjat (2000) Uniwersytet Ekonomiczny we Wrocławiu, Wydział Gospodarki Narodowej, Finanse Przedsiębiorstw - magister (2002)",wyższe,magister,0,ekonomista,3,Wrocław,dolnośląskie,26404,brak,1,True,,,
23,Jacek Bogucki,PiS,1959-02-13,66,Wysokie Mazowieckie,M,"Politechnika Lubelska, Wydział Technologii i Eksploatacji Maszyn, Mechanika - magister inżynier (1982)",wyższe,magister inżynier,0,inżynier mechanik,24,Białystok,podlaskie,12032,"poseł na Sejm RP V, VI, VII i VIII kadencji, senator X kadencji",5,True,,,
24,Zbigniew Bogucki,PiS,1980-01-26,45,Góra,M,"Uniwersytet Szczeciński, Wydział Prawa i Administracji, Prawo - magister (2004)",wyższe,magister,0,adwokat,41,Szczecin,zachodniopomorskie,26375,brak,1,False,Zrzeczenie,Powołany na stanowisko Szefa Kancelarii Prezydenta RP,Objęcie funkcji w administracji centralnej
25,Krzysztof Bojarski,KO,1968-07-11,57,Annopol,M,"Uniwersytet Medyczny w Lublinie, Wydział Lekarski, Lekarski - lekarz (1992)",wyższe,lekarz,0,lekarz,6,Lublin,lubelskie,10672,brak,1,True,,,
26,Joanna Borowiak,PiS,1967-08-20,58,Włocławek,K,"Wyższa Szkoła Pedagogiczna w Bydgoszczy, Wydział Pedagogiczny, Wychowanie Muzyczne - magister (1993) Uniwersytet Mikołaja Kopernika w Toruniu, Pedagogika - doktor (2005) Uniwersytet Mikołaja Kopernika w Toruniu, Pedagogika Zdolności i Twórczości (2018) - studia podyplomowe Wyższa Szkoła Kultury Społecznej i Medialnej w Toruniu, Relacje Międzynarodowe i Dyplomacja (2018) - studia podyplomowe",wyższe,doktor,2,"nauczyciel, nauczyciel akademicki",5,Toruń,kujawsko-pomorskie,25995,poseł na Sejm RP VIII i IX kadencji,3,True,,,
27,Kamil Bortniczuk,PiS,1983-06-11,42,Głuchołazy,M,"Uniwersytet Wrocławski, Wydział Nauk Społecznych, Stosunki Międzynarodowe - magister (2007) Uniwersytet Wrocławski, Fundusze Strukturalne Unii Europejskiej (2008) - studia podyplomowe Uniwersytet Gdański, Wydział Prawa i Administracji, Prawo - magister (2017) Akademia WSB w Dąbrowie Górniczej, MBA (2019) - studia podyplomowe",wyższe,magister,2,"menedżer, prawnik, urzędnik państwowy",16,Płock,mazowieckie,31555,poseł na Sejm RP VIII i IX kadencji,3,True,,,
28,Piotr Borys,KO,1976-01-11,50,Bolesławiec,M,"Uniwersytet Wrocławski, Wydział Prawa i Administracji, Prawo - magister (2001)",wyższe,magister,0,prawnik,1,Legnica,dolnośląskie,44912,poseł na Sejm RP IX kadencji,2,True,,,
29,Bożena Borys-Szopa,PiS,1954-03-11,71,Lędziny,K,"Uniwersytet Śląski, Wydział Prawa i Administracji, Prawo - magister (1996) Akademia Górniczo-Hutnicza w Krakowie, Zarządzanie Przedsiębiorstwem (1998) - studia podyplomowe",wyższe,magister,1,prawnik,29,Katowice,śląskie,30445,poseł na Sejm RP VIII i IX kadencji,3,True,,,
30,Marcin Bosacki,KO,1970-11-05,55,Poznań,M,"Uniwersytet im. Adama Mickiewicza w Poznaniu, Wydział Historyczny - magister (1995)",wyższe,magister,0,historyk,39,Poznań,wielkopolskie,24197,senator X kadencji,2,True,,,
31,Karina Anna Bosak,Konfederacja,1988-07-08,37,Szczecin,K,"Uniwersytet Warszawski, Wydział Prawa i Administracji, Prawo - magister (2012)",wyższe,magister,0,adwokat,20,Warszawa,mazowieckie,21217,brak,1,True,,,
32,Krzysztof Bosak,Konfederacja,1982-06-13,43,Zielona Góra,M,I Liceum Ogólnokształcące w Zielonej Górze (2000),średnie ogólne,,0,parlamentarzysta,24,Białystok,podlaskie,44902,poseł na Sejm RP V i IX kadencji,3,True,,,
33,Grzegorz Braun,Konfederacja,1967-03-11,58,Toruń,M,"Uniwersytet Wrocławski, Wydział Filologiczny, Polonistyka - magister (1993)",wyższe,magister,0,"publicysta, reżyser",23,Rzeszów,podkarpackie,26895,poseł na Sejm RP IX kadencji,2,False,Zrzeczenie,Wybrany na posła do Parlamentu Europejskiego,Mandat w Parlamencie Europejskim
34,Krzysztof Brejza,KO,1983-05-16,42,Bydgoszcz,M,"Uniwersytet Warszawski, Wydział Prawa i Administracji, Prawo - magister (2007) Uniwersytet Warszawski, Wydział Dziennikarstwa i Nauk Politycznych, Stosunki Międzynarodowe - magister (2012) Szkoła Wyższa Psychologii Społecznej w Warszawie, Nauki Prawne - doktor (2014)",wyższe,doktor,0,prawnik,4,Bydgoszcz,kujawsko-pomorskie,89840,"poseł na Sejm RP VI, VII i VIII kadencji, senator X kadencji",4,False,Zrzeczenie,Objął mandat posła do Parlamentu Europejskiego,Mandat w Parlamencie Europejskim
35,Agnieszka Buczyńska,Polska2050,1986-09-22,39,Tczew,K,"Uniwersytet Gdański, Wydział Nauk Społecznych, Politologia - licencjat (2009) Wyższa Szkoła Zarządzania, Wydział Nauk Społecznych, Socjologia - licencjat (2009) Collegium Civitas (Warszawa), Wydział Nauk Społecznych, Socjologia - magister (2012) Wyższa Szkoła Bankowa w Gdańsku, MBA LEADERSHIP (2020) - studia podyplomowe",wyższe,magister,1,"politolog, socjolog",25,Gdańsk,pomorskie,35213,brak,1,True,,,
36,Waldemar Buda,PiS,1982-09-21,43,Turek,M,"Uniwersytet Łódzki, Wydział Prawa i Administracji, Prawo - magister (2006) Aplikacja Radcowska przy OIRP w Łodzi, Radca Prawny (2011) - studia podyplomowe",wyższe,magister,1,radca prawny,9,Łódź,łódzkie,45474,poseł na Sejm RP VIII i IX kadencji,3,False,Zrzeczenie,Wybrany na posła do Parlamentu Europejskiego,Mandat w Parlamencie Europejskim
37,Borys Budka,KO,1978-03-11,47,Czeladź,M,"Uniwersytet Śląski, Wydział Prawa i Administracji, Prawo - magister (2002) Uniwersytet Ekonomiczny w Katowicach, Wydział Finansów i Ubezpieczeń, Ekonomia - doktor (2011)",wyższe,doktor,0,"nauczyciel akademicki, radca prawny",31,Katowice,śląskie,101258,"poseł na Sejm RP VII, VIII i IX kadencji",4,False,Zrzeczenie,Wybrany na posła do Parlamentu Europejskiego,Mandat w Parlamencie Europejskim
38,Elżbieta Burkiewicz,Polska2050,1964-10-17,61,Mielec,K,"Uniwersytet Śląski, Wydział Pedagogiczno-Artystyczny, Wychowanie Plastyczne - magister (1991)",wyższe,magister,0,przedsiębiorca prywatny,23,Rzeszów,podkarpackie,11582,brak,1,True,,,
39,Lidia Burzyńska,PiS,1964-08-27,61,Rzeki Wielkie,K,"Uniwersytet Śląski, Wydział Nauk Społecznych, Historia - magister (1990) Wyższa Szkoła Pedagogiczna w Częstochowie, Fizyka z Informatyką (1999) - studia podyplomowe Wyższa Szkoła Zarządzania i Przedsiębiorczości w Kaliszu, Organizacja i Zarządzanie - menedżer w oświacie (2001) - studia podyplomowe Regionalny Ośrodek Doskonalenia Nauczycieli ""WOM"", Oligofrenopedagogika (2007) - studia podyplomowe",wyższe,magister,3,nauczyciel,28,Częstochowa,śląskie,49713,poseł na Sejm RP VIII i IX kadencji,3,True,,,
40,Marek Jan Chmielewski,KO,1962-05-06,63,Dzierżoniów,M,"Akademia Rolnicza we Wrocławiu, Wydział Technologii Żywności, Technologia Żywności - magister inżynier (1986)",wyższe,magister inżynier,0,technolog żywności,2,Wałbrzych,dolnośląskie,9108,brak,1,True,,,
41,Zbigniew Chmielowiec,PiS,1954-09-22,71,Kolbuszowa,M,"Politechnika Krakowska, Wydział Inżynierii Sanitarnej - magister inżynier (1980)",wyższe,magister inżynier,0,inżynier inżynierii środowiska,23,Rzeszów,podkarpackie,18574,"poseł na Sejm RP V, VI, VII, VIII i IX kadencji",6,True,,,
42,Artur Chojecki,PiS,1974-04-19,51,Elbląg,M,"Uniwersytet Warmińsko-Mazurski, Wydział Teologii, Teologia - magister (2001)",wyższe,magister,0,urzędnik państwowy,35,Olsztyn,warmińsko-mazurskie,17418,brak,1,True,,,
43,Kazimierz Bogusław Choma,PiS,1957-12-16,68,Kraśnik,M,"Akademia Górniczo-Hutnicza w Krakowie, Wydział Metali Nieżelaznych, Metalurgia Metali Nieżelaznych - magister inżynier (1981) Wyższa Szkoła National-Louis University w Nowym Sączu, Zarządzanie Firmą (1998) - studia podyplomowe Warszawska Szkoła Zarządzania-Szkoła Wyższa, Zarządzanie Nieruchomościami (2012) - studia podyplomowe Collegium Humanum - Szkoła Główna Menedżerska w Warszawie, Executive Master of Business Administration (MBA) (2020) - studia podyplomowe",wyższe,magister inżynier,3,zarządzanie zasobami ludzkimi,6,Lublin,lubelskie,8363,poseł na Sejm RP IX kadencji,2,True,,,
44,Dominika Chorosińska,PiS,1978-12-29,47,Elbląg,K,"Państwowa Wyższa Szkoła Teatralna w Krakowie, Wydział Aktorski, Aktorstwo Dramatyczne - magister sztuki (2000) Akademia Leona Koźmińskiego w Warszawie, Zarządzanie w Mediach (2022) - studia podyplomowe",wyższe,magister,1,aktorka,20,Warszawa,mazowieckie,9582,poseł na Sejm RP IX kadencji,2,True,,,
45,Tadeusz Chrzan,PiS,1963-09-14,62,Grodzisko Dolne,M,"Politechnika Lubelska, Wydział Zarządzania, Przedsiębiorczość i Marketing - magister (2010) Wyższa Szkoła Menedżerska w Warszawie, Executive Master of Business Administration (2018) - studia podyplomowe",wyższe,magister,1,geodeta,22,Krosno,podkarpackie,12184,poseł na Sejm RP IX kadencji,2,True,,,
46,Alicja Chybicka,KO,1951-05-10,74,Wałbrzych,K,"Akademia Medyczna we Wrocławiu, Wydział Lekarski, Nauki Medyczne - lekarz (1975)",wyższe,lekarz,0,lekarz,3,Wrocław,dolnośląskie,78816,"poseł na Sejm RP VIII kadencji, senator VIII i X kadencji",2,True,,,
47,Anna Ewa Cicholska,PiS,1962-02-07,63,Ciechanów,K,"Uniwersytet Mikołaja Kopernika w Toruniu, Wydział Matematyki, Fizyki i Chemii, Chemia - magister (1991) Uniwersytet Warszawski, Fizyka z Astronomią (2001) - studia podyplomowe",wyższe,magister,1,nauczyciel,16,Płock,mazowieckie,19074,poseł na Sejm RP VIII i IX kadencji,3,True,,,
48,Janusz Cichoń,KO,1957-01-07,69,Bytom,M,"Akademia Rolniczo-Techniczna w Olsztynie, Wydział Rolniczy, Ekonomika Rolnictwa - magister inżynier (1981) Szkoła Główna Handlowa w Warszawie, Ekonomia - doktor (1990)",wyższe,doktor,0,"emeryt, nauczyciel akademicki",35,Olsztyn,warmińsko-mazurskie,32356,"poseł na Sejm RP VI, VII, VIII i IX kadencji",5,True,,,
49,Krzysztof Ciecióra,PiS,1989-06-27,36,Radomsko,M,"Uniwersytet Opolski, Wydział Historyczno-Pedagogiczny, Historia - magister (2014) Uniwersytet Warszawski, Podyplomowe Studia Menadżerskie (2018) - studia podyplomowe Akademia WSB, Master of Business Administration z EY Academy of (2019) - studia podyplomowe",wyższe,magister,2,wyższy urzędnik państwowy,10,Piotrków Trybunalski,łódzkie,10426,brak,1,True,,,
50,Janusz Cieszyński,PiS,1988-05-06,37,Wrocław,M,"Szkoła Główna Handlowa w Warszawie, Finanse i Rachunkowość - licencjat (2012)",wyższe,licencjat,0,menedżer,35,Olsztyn,warmińsko-mazurskie,20644,brak,1,True,,,
51,Michał Cieślak,PiS,1974-12-09,51,Dąbrowa Tarnowska,M,"Uniwersytet Rolniczy im. H. Kołłątaja w Krakowie, Wydział Rolniczy, Agroekonomia - magister inżynier (2001) Wyższa Warszawska Szkoła Biznesu, MBA (2017) - studia podyplomowe",wyższe,magister inżynier,1,ekonomista,33,Kielce,świętokrzyskie,5629,poseł na Sejm RP VIII i IX kadencji,3,True,,,
52,Żaneta Cwalina-Śliwowska,Polska2050,1978-12-10,47,Ostrołęka,K,"Uniwersytet Zielonogórski, Pedagogika Społeczna - magister (2004) Szkoła Główna Handlowa w Warszawie, Menedżer Kultury - studia podyplomowe",wyższe,magister,1,"pedagog, trener",18,Siedlce,mazowieckie,9747,brak,1,True,,,
53,Krzysztof Czarnecki,PiS,1957-10-25,68,Trzcianka,M,"Technikum Budowlano-Drogowe w Pile, Technik Budowlano-Drogowy - technik (1977)",średnie zawodowe,,0,technik budowlano-drogowy,38,Piła,wielkopolskie,37420,poseł na Sejm RP V i IX kadencji,3,True,,,
54,Witold Wojciech Czarnecki,PiS,1953-04-12,72,Murowana Goślina,M,"Politechnika Poznańska, Wydział Budownictwa Lądowego, Budownictwo Miejskie i Przemysłowe - magister inżynier (1977) Politechnika Poznańska, Wydział Budownictwa Lądowego, Nauki Techniczne - doktor (1987)",wyższe,doktor,0,nauczyciel akademicki,37,Konin,wielkopolskie,17601,"poseł na Sejm RP V, VI, VII, VIII i IX kadencji",6,True,,,
55,Przemysław Czarnek,PiS,1977-06-11,48,Koło,M,"Katolicki Uniwersytet Lubelski, Wydział Prawa, Prawa Kanonicznego i Administracji, Prawo - magister (2001) Katolicki Uniwersytet Lubelski Jana Pawła II, Prawo Konstytucyjne - doktor (2006) Katolicki Uniwersytet Lubelski Jana Pawła II, Prawo Konstytucyjne - doktor habilitowany (2015)",wyższe,doktor,0,prawnik,6,Lublin,lubelskie,121686,poseł na Sejm RP IX kadencji,2,True,,,
56,Arkadiusz Czartoryski,PiS,1966-04-14,59,Ostrołęka,M,"Katolicki Uniwersytet Lubelski Jana Pawła II, Wydział Humanistyczny, Historia - magister (1991) Akademia Sztuki Wojennej, Bezpieczeństwo Narodowe (2023) - studia podyplomowe",wyższe,magister,1,urzędnik samorządowy,18,Siedlce,mazowieckie,15845,"poseł na Sejm RP V, VI, VII, VIII i IX kadencji",6,True,,,
57,Włodzimierz Czarzasty,Lewica,1960-05-03,65,Warszawa,M,"Uniwersytet Warszawski, Wydział Dziennikarstwa i Nauk Politycznych, Stosunki Międzynarodowe - magister (1988)",wyższe,magister,0,politolog,32,Katowice,śląskie,22332,poseł na Sejm RP IX kadencji,2,True,,,
58,Jacek Czerniak,Lewica,1964-08-30,61,Świdnik,M,"Uniwersytet Marii Curie-Skłodowskiej w Lublinie, Wydział Nauk Politycznych, Nauki Polityczne - magister (1989) Uniwersytet Marii Curie-Skłodowskiej w Lublinie, Zarządzanie i Administracja (2001) - studia podyplomowe",wyższe,magister,1,politolog,6,Lublin,lubelskie,10910,poseł na Sejm RP VII i IX kadencji,3,True,,,
59,Zofia Czernow,KO,1950-09-30,75,Wola Obszańska,K,"Wyższa Szkoła Ekonomiczna we Wrocławiu, Wydział Gospodarki Narodowej, Ekonomika Przemysłu - magister (1974) Polska Akademia Nauk w Warszawie, Europejskie Prawo Bankowe (2000) - studia podyplomowe Akademia Ekonomiczna we Wrocławiu, Wykorzystanie Funduszy z UE (2005) - studia podyplomowe",wyższe,magister,2,ekonomista,1,Legnica,dolnośląskie,30258,"poseł na Sejm RP VII, VIII i IX kadencji",4,True,,,
60,Anita Czerwińska,PiS,1970-01-13,55,Warszawa,K,"Uniwersytet Warszawski, Wydział Prawa i Administracji, Prawo - magister (1999)",wyższe,magister,0,prawnik,20,Warszawa,mazowieckie,18443,poseł na Sejm RP VIII i IX kadencji,3,True,,,
61,Katarzyna Czochara,PiS,1969-11-03,56,Biała,K,"Uniwersytet Wrocławski, Wydział Filologii Germańskiej, Filologia Germańska - magister (2008)",wyższe,magister,0,nauczyciel,21,Opole,opolskie,20004,poseł na Sejm RP VIII i IX kadencji,3,True,,,
62,Sławomir Ćwik,Polska2050,1972-01-21,53,Zamość,M,"Uniwersytet Marii Curie-Skłodowskiej w Lublinie, Wydział Prawa i Administracji, Prawo - magister (1996) Szkoła Główna Handlowa w Warszawie, Podatki (1998) - studia podyplomowe",wyższe,magister,1,"menedżer, prawnik, przedsiębiorca prywatny",7,Chełm,lubelskie,8004,brak,1,True,,,
63,Władysław Dajczak,PiS,1959-07-10,66,Międzyrzec,M,"Wyższa Szkoła Inżynierska w Zielonej Górze, Instytut Budowy Maszyn, Mechanika-Maszyny i Urządzenia Przemysłu Spożywczego - magister inżynier (1983) Uniwersytet Wrocławski, Prawo i Administracja (1997) - studia podyplomowe",wyższe,magister inżynier,1,inżynier mechanik,8,Zielona Góra,lubuskie,29131,"poseł na Sejm RP IX kadencji, senator VII kadencji",2,True,,,
64,Anna Dąbrowska-Banaszek,PiS,1961-04-14,64,Chełm,K,"Akademia Medyczna w Lublinie, Wydział Lekarski, Lekarz medycyny - lekarz (1986) Wyższa Szkoła Zawodowa Kosmetyki i Pielęgnacji Zdrowia w Warszawie, Kosmetologia w Medycynie (2010) - studia podyplomowe",wyższe,lekarz,1,lekarz,7,Chełm,lubelskie,13910,poseł na Sejm RP IX kadencji,2,True,,,
65,Zbigniew Dolata,PiS,1965-12-01,60,Koźmin,M,"Wyższa Szkoła Pedagogiczna w Opolu, Wydział Filologiczno-Historyczny, Historia - magister (1989) Uniwersytet im. Adama Mickiewicza w Poznaniu, Politologia (2000) - studia podyplomowe",wyższe,magister,1,nauczyciel,37,Konin,wielkopolskie,25663,"poseł na Sejm RP V, VI, VII, VIII i IX kadencji",6,True,,,
66,Barbara Dolniak,KO,1960-09-12,65,Bytom,K,"Uniwersytet Śląski, Wydział Prawa i Administracji, Prawo - magister (1983) Sąd Wojewódzki w Katowicach, Aplikacja Sądowa (1987) Uniwersytet Śląski, Prawo Unii Europejskiej (2007) - studia podyplomowe Olsztyńska Wyższa Szkoła Informatyki i Zarządzania im. Prof. Kotarbińskiego w Olsztynie, Public Relations (2011) - studia podyplomowe Krajowa Szkoła Sądownictwa i Prokuratury we współpracy z Instytutem Polskiej Akademii Nauk, Prawo Cywilne (2013) - studia podyplomowe",wyższe,magister,3,prawnik,32,Katowice,śląskie,37470,poseł na Sejm RP VIII i IX kadencji,3,True,,,
67,Andrzej Domański,KO,1981-08-27,44,Kraków,M,"Akademia Ekonomiczna, Wydział Ekonomii, Ekonomia - magister (2005)",wyższe,magister,0,"doradca ds. ekonomicznych, ekonomista",19,Warszawa,mazowieckie,6848,brak,1,True,,,
68,Bartłomiej Dorywalski,PiS,1979-08-16,46,Włoszczowa,M,"Katolicki Uniwersytet Lubelski, Wydział Prawa, Prawa Kanonicznego i Administracji, Prawo - magister (2003) Katolicki Uniwersytet Lubelski Jana Pawła II, Nauki Prawne - doktor (2015)",wyższe,doktor,0,radca prawny,33,Kielce,świętokrzyskie,9696,poseł na Sejm RP VI i IX kadencji,3,True,,,
69,Robert Dowhan,KO,1967-07-14,58,Lubsko,M,"Akademia Wychowania Fizycznego, Wydział Sportowy, Nauczycielski - magister (1991)",wyższe,magister,0,parlamentarzysta,8,Zielona Góra,lubuskie,14761,"senator VIII, IX i X kadencji",4,True,,,
70,Przemysław Drabek,PiS,1979-10-02,46,Bielsko-Biała,M,"Wyższa Szkoła Ekonomiczno Humanistyczna, Zarządzanie i Marketing - licencjat (2002) Wyższa Szkoła Ekonomiczno Humanistyczna, Zarządzanie - magister (2021)",wyższe,magister,0,menedżer,27,Bielsko-Biała,śląskie,17886,poseł na Sejm RP IX kadencji,2,True,,,
71,Elżbieta Duda,PiS,1962-11-20,63,Skała,K,"Państwowe Studium Sztuk Plastycznych, Konserwacja Rzeźby, Konserwacja Rzeźby Architektonicznej - technik (1983)",średnie policealne/pomaturalne,,0,parlamentarzysta,13,Kraków,małopolskie,11388,poseł na Sejm RP VIII i IX kadencji,3,True,,,
